9952173679101401,.b11455457,"New Jersey, a guide to its present and past; compiled and written by the Federal Writers' Project of the Works Progress Administration for the State of New Jersey ... Sponsored by the Public Library of Newark and the New Jersey Guild Associates.","New York, The Viking Press, 1939."
9952173687801401,.b11453989,Remain to be seen; historic California houses open to the public.,"Berkeley, Calif., Howell-North Books [1973]"
9952173769801401,.b11475730,This way southward; a journey through Patagonia and Tierra de Fuego.,"New York, W. W. Norton & company, inc. [c1940]"
9952173779501401,.b11476187,"Chile, by Erna Fergusson.","New York, A.A. Knopf, 1943."
9952173880301401,.b11471475,"South America called them; explorations of the great naturalists: La Condamine, Humboldt, Darwin, Spruce [by] Victor Wolfgang Von Hagen.","New York, A.A. Knopf, 1945."
9952173880901401,.b11472418,The Amazon: a new frontier?...,[New York] Foreign Policy Association [1944]
9952173881801401,.b11471384,Between Maule and Amazon [by] Arnold J. Toynbee.,"London, New York [etc.] Oxford U.P., 1967."
9952174039301401,.b11469833,South by thunderbird [by] Hudson Strode.,"New York, Harcourt, Brace [1945]"
9952174719501401,.b11569323,The sociology of Colonial Virginia.,"New York, Philosophical Library [1968]"
9952174794101401,.b11583708,Tramping with a poet in the Rockies / by Stephen Graham ; with thirty-eight emblems by Vernon Hill.,"New York : D. Appleton, 1922."
9952174814801401,.b11586138,"Piñon country, by Haniel Long.","New York, Duell, Sloan & Pearce [c1941]"
9952174847001401,.b11575189,"Seeing the middle West, by John T. Faris...with frontispiece in color and 91 doubletone illustrations.","Philadelphia, London, J.B. Lippincott company, 1923."
9952174847701401,.b11575074,Master of the Mississippi; Henry Shreve and the conquest of the Mississippi.,"Boston, Houghton Mifflin Company, 1941."
9952174922501401,.b11586667,"The day of the cattleman, by Ernest Staples Osgood.","Minneapolis, The University of Minnesota Press, 1929."
9952174936301401,.b11589516,"Pike's Peak gold rush guidebooks of 1859 by Luke Tierney [and] William B. Parsons, and summaries of the other fifteen; edited by Le Roy R. Hafen ...","Glendale, Calif., The Arthur H. Clark Company, 1941."
9952174941701401,.b1158189x,The Old West speaks. Water-color paintings by William Henry Jackson.,"Englewood Cliffs, N.J., Prentice-Hall [1956]"
9952175014301401,.b11608109,The thousand mile summer in desert and high sierra. With photos. by the author.,"Berkeley, Calif., Howell-North Books, 1964."
9952175135801401,.b11610098,"Rider's California; a guide-book for travelers, with 28 maps and plans, compiled under the general editorship of Fremont Rider, by Frederic Taber Cooper, A. M., PH. D.","New York, The Macmillan company; London, G. Allen & Unwin, ltd., 1925."
9952175139301401,.b11608821,"Pioneer notes from the diaries of Judge Benjamin Hayes, 1849-1875.","Los Angeles, Priv. print., 1929."
9952175582801401,.b11637936,"Social thought in America, the revolt against formalism.","New York, Viking Press, 1949."
9952175714801401,.b11628807,India: the social anthropology of a civilization [by] Bernard S. Cohn.,"Englewood Cliffs, N.J., Prentice-Hall [1971]"
9952175742601401,.b11635368,"Great times : an informal social history of the United States, 1914-1929 / by J. C. Furnas.","New York : Putnam, [1974]"
9952175752001401,.b1164929x,"Population problems in the United States and Canada; an outgrowth of papers presented at the eighty-sixth annual meeting of the American Statistical Association, December, 1924, edited by Louis I. Dublin ...","Boston, New York, Houghton Mifflin Company, 1926."
9952175855601401,.b11684458,"Reformation to Industrial Revolution; the making of modern English society, 1530-1780 [by] Christopher Hill.","New York, Pantheon Books [1968, c1967]"
9952176043501401,.b11679864,Social thought from lore to science ... by Harry Elmer Barnes ... and Howard Becker ... with the assistance of Emile Benoît-Smullyan and others.,"Boston, New York [etc.] D. C. Heath and Company [c1938]"
9952161425901401,.b1001620x,The Scandinavian theatre : a short history / [by] Frederick J. Marker and Lise-Lone Marker.,"Oxford : Blackwell, 1975."
9952162008701401,.b1009605x,Ruth Suckow / by Abigail Ann Hamblen.,"Boise : Boise State University, c1978."
9952162121001401,.b10103399,The great succession : Henry James and the legacy of Hawthorne / Robert Emmet Long.,"Pittsburgh : University of Pittsburgh Press, c1979."
9952162154301401,.b10144079,The shape of Hawthorne's career / Nina Baym.,"Ithaca, N.Y. : Cornell University Press, 1976."
9952162651201401,.b10168096,"Playwrights for tomorrow; a collection of plays, edited, with an introd. by Arthur H. Ballet.","Minneapolis, University of Minnesota Press [1966-"
9952163061401401,.b10256507,Society and bureaucracy in contemporary Ghana / Robert M. Price.,"Berkeley : University of California Press, c1975."
9952163392101401,.b10275216,Structures mentales et creation culturelle.,"Paris, Editions Anthropos [1970]"
9952163609301401,.b10294995,Mid-century drama.,"London : Faber and Faber, 1962."
9952163708701401,.b10291490,Cosmic satire in the contemporary novel / John W. Tilton.,"Lewisburg, [Pa.] : Bucknell University Press, c1977."
9952163851201401,.b10308519,From option to opening / Donald C. Farber.,"New York : Drama Book Specialists, c1977."
9952164150501401,.b10325748,Tomorrow's American / edited by Samuel Sandmel.,"New York : Oxford University Press, 1977."
9952164513801401,.b10401490,"The new Europeans: a guide to the workings, institutions and character of contemporary Western Europe.","London, Hodder & Stoughton, 1968."
9952165400901401,.b10502646,Alaska : a travel survival kit / Jim DuFresne.,"Hawthorn, Vic., Australia ; Berkeley, Calif. : Lonely Planet Publications, 1994."
9952165809101401,.b10541408,"Essays on European literature, in honor of Liselotte Dieckmann. Edited by Peter Uwe Hohendahl, Herbert Lindenberger [and] Egon Schwarz.","St. Louis, Washington University Press [1972]"
9952165846001401,.b10522104,Allegory / John MacQueen.,"London : Methuen, c1970."
9952166087901401,.b10584067,Curtains; selections from the drama criticism and related writings.,"New York, Atheneum, 1961."
9952166123901401,.b10579928,An introduction to the Chinese theatre.,"New York, Theatre Arts Books [1959]"
9952166564001401,.b10656121,"A study of the modern drama; a handbook for the study and appreciation of the best plays, European, English and American, of the last half century, by Barrett H. Clark.","New York, London, D. Appleton and Company, 1925."
9952166682301401,.b10651809,"The cruelest month; spring, nature, and love in classical and medieval lyrics, by James J. Wilhelm.","New Haven, Yale University Press, 1965."
9952166695601401,.b10657538,Tragedy and comedy.,"New York, Simon and Schuster [1967]"
9952166711101401,.b10651937,"The problem-play and its influence on modern thought and life, by Ramsden Balmforth.","New York, H. Holt and company, 1928."
9952166756001401,.b10685820,"Inheritors; a play in three acts, by Susan Glaspell.","Boston, Small, Maynard [c1921]"
9952166771101401,.b10675139,"Twentieth century interpretations of The ambassadors; a collection of critical essays, edited by Albert E. Stone, Jr.","Englewood Cliffs, N.J., Prentice-Hall [1969]"
9952166776401401,.b1067035x,"The old maid, dramatized by Zoe Akins from the novel by Edith Wharton.","New York, London, D. Appleton-Century Company, Incorporated, 1935."
9952166784701401,.b10671110,"Hotel universe, a play, by Philip Barry.","New York, Los Angeles, S. French; London, S. French ltd., 1930."
9952166800001401,.b10660859,The moral and the story [by] Ian Gregor & Brian Nicholas.,"London, Faber and Faber [1962]"
9952166806301401,.b10661384,"Five masters; a study in the mutations of the novel, by Joseph Wood Krutch.","New York, J. Cape & H. Smith [c1930]"
9952166827401401,.b10662492,Roman et lumieres au XVIIIe [i. e. dix-huitieme] siecle. Colloque sous la presidence de Werner Krauss [et al.] Avec la participation de G. Benrekassa [et al.],"Paris, Editions sociales [1970]"
9952166855001401,.b10677811,The dungeon of the heart; human isolation and the American novel [by] Edwin T. Bowden.,"New York, Macmillan, 1961."
9952166877901401,.b10678864,Twelve original essays on great American novels.,"Detroit, Wayne State University Press, 1958."
9952166890101401,.b10674536,"Nathaniel Hawthorne, by George E. Woodberry.","Boston, and New York, Houghton, Mifflin and Co., 1902."
9952166892501401,.b10672448,"Representative American dramas, national and local, edited with introductions, by Montrose J. Moses, revised and brought up to date by Joseph Wood Krutch ...","Boston, Little, Brown and Company, 1941."
9952166910801401,.b10673180,Drama and commitment; politics in the American theatre of the thirties.,"Bloomington, Indiana University Press, 1964."
9952166912901401,.b10673064,American dramatic literature; ten modern plays in historical perspetive.,"New York, McGraw-Hill, 1961."
9952166913801401,.b10673003,"The theme of loneliness in modern American drama, by Winifred L. Dusenbury.","Gainesville, University of Florida Press, 1960."
9952166956201401,.b10698917,"Dear Prue's husband and other people, by Joseph J. Reilly ...","New York, The Macmillan Company, 1932."
9952166956501401,.b10698899,Studies in literature. Third series. By Sir Arthur Quiller-Couch.,"New York, G. P. Putnam's sons; Cambridge, Eng., University press, 1930."
9952166975201401,.b10704607,The education of H*y*m*a*n* K*a*p*l*a*n / by Leonard Q. Ross.,"New York : Harcourt, Brace & World, c1937."
9952166992801401,.b10692095,Books in black or red / by Edmund Lester Pearson.,"New York : The Macmillan company, 1923."
9952166993201401,.b10692071,Plays of Eugene O'Neill.,"New York, Random House [c1955]"
9952167001501401,.b10690918,"A New England group and others; Shelburne essays, eleventh series, by Paul Elmer More.","Boston, New York, Houghton Mifflin company, 1921."
9952167005201401,.b10690566,"Shelburne essays, by Paul Elmer More.","New York and London, G.P.Putnam's sons, 1905."
9952167005901401,.b10690529,"Shelburne essays, by Paul Elmer More.","New York, London, G. P. Putnam's sons, 1904."
9952167014301401,.b10696441,"Behind the magic curtain, eight folk scenes originally presented by the junior players of the Neighborhood Playhouse for the National Theatre Conference.","New York, Theatre Arts, inc. [c1934]"
9952167017401401,.b10693191,"Futz, and what came after. With an introd. by Jerome Rothenberg.","New York, Random House [1968]"
9952167058301401,.b1070100x,"Orations of American orators, including biographical and critical sketches, with a special introduction by Julian Hawthorne.","New York, The Colonial press [c1900]"
9952167062301401,.b10700584,"A book of modern essays, ed. by Bruce Welker McCullough and Edwin Berry Burgum.","New York, Scribner [c1926]"
9952167063801401,.b10700432,"Heart of man, and other papers.","New York, Harcourt, Brace and Howe, 1920."
9952167074801401,.b10702866,"Thoughts without words, by Clarence Day.","New York, London, A. A. Knopf, 1928."
9952167082601401,.b10706768,"Collected writings and addresses of William Chapin Deming, ed. by Agnes Wright Spring.","Glendale, Calif., Priv. print. by the A. H. Clark Co., 1946-47."
9952167096901401,.b1069738x,"The delight of great books, by John Erskine.","Indianapolis, The Bobbs-Merrill Company [c1928]"
9952167125301401,.b10694699,Sunrise at Campobello; a play in three acts.,"New York, Random House [1958]"
9952167208201401,.b10710930,The dissenting opinions of Mister Westbrook Pegler.,"New York, C. Scribner's sons, 1938."
9952167455001401,.b10760799,The Japanese people : origins of the people and the language / By Isao Komatsu.,"Tokyo : Kokusai Bunka Shinkokai, 1962."
9952168205201401,.b10825289,"The centenary edition of the works of Nathaniel Hawthorne / [editors, William Charvat ... et al.].","Columbus : Ohio State University Press, c1962-1988."
9952170057701401,.b11265243,Emerson's angle of vision : man and nature in American experience / Sherman Paul.,"Cambridge [Mass.] : Harvard University Press, c1952 (1965 printing)"
9952170138901401,.b11253423,The literature of the Anglo-Saxons / by George K. Anderson.,"Princeton, N.J. : Princeton University Press, 1949."
9952170139801401,.b11253332,"History of English literature ... by Bernhard ten Brink, tr. from the German.","New York, H. Holt and company, 1883-1896."
9952170649401401,.b11298649,"The real and the ideal in the novella of Italy, France, and England; four centuries of change in the Boccaccian tale.","Chapel Hill : University of North Carolina Press, 1968."
9952171154901401,.b11377124,John Barth : an introduction / David Morrell.,"University Park : Pennsylvania State University Press, c1976."
9952171170201401,.b11379807,The imaginary voyage in prose fiction / Philip Babcock Gove.,"New York : Arno Press, 1974."
9952171446601401,.b11382533,"Jackson Hole, Wyoming : in the shadows of the Tetons.","Norman : University of Oklahoma Press, 1970."
9952172583801401,.b11078856,An artist in the rigging: the early work of Herman Melville [by] William B. Dillingham.,"Athens, University of Georgia Press [1972]"
9952172616001401,.b11071473,The dialogues of Archibald MacLeish and Mark Van Doren Edited by Warren V. Bush.,"New York, Dutton, 1964."
9952172821701401,.b11083797,Chronological outlines of American literature / by Selden L. Whitcomb. A. M.  ; with an introduction by Brander Matthews.,"New York ; London : Macmillan and co., 1906."
9952172886301401,.b11112335,"Our new West : records of travel between the Mississippi River and the Pacific Ocean. Over the plains--over the mountains--through the great interior basin--over the Sierra Nevadas--to and up and down the Pacific coast. With details of the wonderful natural scenery, agriculture, mines, business, social life, progress, and prospects ... including a full description of the Pacific railroad; and of the life of the Mormons, Indians, and Chinese. With map, portraits and twelve full page illustrations. / by Samuel Bowles.","Hartford, Ct. : Hartford Pub. Co., [etc.], 1869."
9952173678501401,.b11455512,"Dixie after the war, by Myrta Lockett Avary ... with an introduction by General Clement A. Evans; illustrated from old paintings, daguerreotypes and rare photographs.","Boston, Houghton Mifflin Company [c1937]"
9952173800601401,.b11460532,"Los Angeles in the sunny seventies. A flower from the golden land, by Ludwig Louis Salvator; translated by Marguerite Eyer Wilbur; introduction by Phil Townsend Hanna.","Los Angeles, B. McCallister, J. Zeitlin, 1929."
9952173820001401,.b11462280,"Oregon, end of the trail, compiled by workers of the Writers' Program of the Work Projects Administration in the state of Oregon ... Sponsored by the Oregon State Board of Control.","Portland, Binfords & Mort [c1940]"
9952173871901401,.b1147824x,"Fire on the Andes [by] Carleton Beals, illustrations by Jose Sabogal.","Philadelphia, London, J.B. Lippincott company, 1934."
9952173873001401,.b11471797,Expresion de Hispanoamerica. Prologo de Francisco Monterde.,"San Juan de P.R., Instituto de Cultura Puertorriqueña [1960-"
9952173893101401,.b11472315,Tagging along.,"New York, Coward, McCann & Geoghegan [1972]"
9952173936301401,.b11456802,"Delaware; a guide to the first state, compiled and written by the Federal writers' project of the Works progress administration for the state of Delaware.","New York, The Viking press, 1938."
9952174039001401,.b11469869,Ten keys to Latin America.,"New York, Knopf, 1962."
9952174050701401,.b11470227,The agony and the triumph : papers on the use and abuse of myth / by Herbert Weisinger.,"[East Lansing] : Michigan State University Press, c1964."
9952174540901401,.b11534047,Les voleuses de langue / Claudine Herrmann.,"[Paris] : des Femmes, 1976."
9952174675501401,.b11577848,"Journal of Rudolph Friedrich Kurz; an account of his experiences among fur traders and American Indians on the Mississippi and the upper Missouri rivers during the years 1846 to 1852; translated by Myrtis Jarrell, edited by J. N. B. Hewitt.","Washington, U. S. Govt. print. off., 1937."
9952174720501401,.b11569219,"The discoveries of John Lederer, with unpublished letters by and about Lederer to Governor John Winthrop, Jr., and an essay on the Indians of Lederer's Discoveries by Douglas L. Rights and William P. Cumming. Edited with notes by William P. Cumming.","Charlottesville, University of Virginia Press, 1958."
9952174721801401,.b11569049,"Intellectual life in Jefferson's Virginia, 1790-1830.","Chapel Hill, University of North Carolina Press [1964]"
9952174830001401,.b11575396,"The great Northwest; a guidebook and itinerary for the use of tourists and travellers over the lines of the Northern Pacific railroad, the Oregon railway and navigation company and the Oregon and California railroad ... with map and many illustrations. By Harry J. Winser. ...","New York, G. P. Putnam's sons, 1883."
9952174917001401,.b11594305,"Grand Canyon of the living Colorado. Photos and a journal by Ernest Braun. Contributions by Colin Fletcher [and others] With excerpts from the narration by David Bower, Jeffrey Ingram, and Martin Litton for the Sierra Club film ""The Grand Canyon"" accompanying the color plates. Edited by Roderick Nash. Foreword by David Brower.",[San Francisco] Sierra Club [1970]
9952174950201401,.b11586394,"A journal of the Birmingham emigrating company; the record of a trip from Birmingham, Iowa, to Sacramento, California, in 1850, by Leander V. Loomis:  together with five early itineraries covered in part by this company.  With supplementary data compiled from historical source and notes and photographs taken along the line of travel: edited by Edgar M. Ledyard.","Salt Lake City, Utah [Legal printing company] 1928."
9952174997301401,.b11609837,A source book in theatrical history = Sources of theatrical history / by A. M. Nagler.,"New York : Dover Publications, 1959, c1952."
9952175133001401,.b11610207,The southern sierras of California by Charles Francis Saunders...illustrated from photographs by the author,Boston and New York Houghton Mifflin company 1923
9952175138201401,.b11609989,"Romantic California, by Ernest Peixotto; illustrations by the author.","New York, C. Scribner's sons, 1910."
9952175368001401,.b11638540,Poverty and progress; social mobility in a nineteenth century city.,"Cambridge, Harvard University Press, 1964."
9952175540301401,.b11627232,A Serbian village in historical perspective by Joel M. Halpern and Barbara Kerewsky Halpern.,"New York, Holt, Rinehart and Winston, Inc. [1972]"
9952175583201401,.b1164803x,"General theory: social, political, economic, and regional, with particular reference to decision-making analysis [by] Walter Isard, in association with Tony E. Smith [and others]","Cambridge, Mass., M.I.T. Press [1969]"
9952175702401401,.b11633463,Hill farmers of Nigeria; cultural ecology of the Kofyar of the Jos Plateau [by] Robert McC. Netting.,"Seattle, University of Washington Press [1968]"
9952175705101401,.b1163313x,Africa: social problems of change and conflict. Readings selected and edited by Pierre L. Van den Berghe.,"San Francisco, Chandler Pub. Co. [1965]"
9952175705801401,.b11633074,New nations.,University of Chicago Press [1963]
9952175745901401,.b11635332,The thirties; a reconsideration in the light of the American political tradition. Edited by Morton J. Frisch and Martin Diamond.,"De Kalb, Northern Illinois University Press [1968]"
9952175865501401,.b11685049,"A West Country village: Ashworthy: family, kinship, and land.","London, Routledge & Paul [1963]"
9952175866401401,.b11685013,Gosforth: the sociology of an English village.,"Glencoe, Ill., Free Press [1956]"
9952176308401401,.b11684033,The one blood : kinship and class in an Irish village / Elliott Leyton.,"[St. John's] : Institute of Social and Economic Research, Memorial University of Newfoundland, c1975."
9952161525601401,.b10023768,"Wealth and power in Tudor England : essays presented to S. T. Bindoff / edited by E. W. Ives, R. J. Knecht, J. J. Scarisbrick.","London : Athlone Press ; [Atlantic Highlands, N.J.] : distributed in the U.S.A. and Canada by Humanities Press, 1978."
9952161626301401,.b10048339,The realists : eight portraits / by C. P. Snow.,"New York : Scribner, c1978."
9952161810101401,.b10068193,Of poetry and poets / Richard Eberhart.,"Urbana : University of Illinois Press, c1979."
9952162277101401,.b1012536x,James Gould Cozzens : new acquist of true experience / edited by Matthew J. Bruccoli.,"Carbondale : Southern Illionis University Press, c1979."
9952162464401401,.b10170819,"CBS Playhouse presents Do not go gentle into that good night /, by Loring Mandel.","[New York? : CBS Television Network, c1967]"
9952163465101401,.b10273992,"The romance in America : studies in Cooper, Poe, Hawthorne, Melville, and James / by Joel Porte.","Middletown, Conn. : Wesleyan University Press, c1969."
9952163726801401,.b10288041,"The Future that doesn't work : social democracy's failures in Britain / edited by R. Emmett Tyrrell, Jr. ; [contributors] Samuel Brittan ... et al.].","Garden City, N.Y. : Doubleday, 1977."
9952164200201401,.b1036027x,Henry James : the lessons of the master : popular fiction and personal style in the nineteenth century / William Veeder.,"Chicago : University of Chicago Press, 1975."
9952165314901401,.b10486331,"The left bank, a play in three acts, by Elmer Rice.","New York, Los Angeles, S. French; London, S. French ltd., 1931."
9952165772001401,.b10545888,Principles of tragedy: a rational examination of the tragic concept in life and literature.,"Coral Gables, Fla. University of Miami Press [c1968]"
9952166119201401,.b10580438,Theatralische Landschaft / Gustav Rudolf Sellner [und] Werner Wien.,Bremen : Carl Schunemann / c1962
9952166252801401,.b10575200,"A history of theatrical art in ancient and modern times, by Karl Mantzius; with an introduction by William Archer. Authorised translation by Louise von Cossell ...","New York, Peter Smith, 1937."
9952166258501401,.b10610959,The illusion of power : political theater in the English Renaissance / Stephen Orgel.,"Berkeley : University of California Press, [1975]"
9952166624101401,.b10631240,"America is West, an anthology of middlewestern life and literature.","Minneapolis, The University of Minnesota Press [1945]"
9952166671601401,.b10650775,Die Logik der Dichtung.,"Stuttgart, E. Klett [1968]"
9952166679001401,.b10650313,The ballade.,"New York, Columbia Univ. Pr., 1915."
9952166683701401,.b10651640,"Sense and poetry; essays on the place of meaning in contemporary verse, by John Sparrow.","New Haven, Yale University Press, 1934."
9952166685601401,.b1065141x,The green cabinet; Theocritus and the European pastoral lyric [by] Thomas G. Rosenmeyer.,"Berkeley, University of California Press, 1969."
9952166699101401,.b10649931,"From Virgil to Milton, by C. M. Bowra.","London, Macmillan & co. ltd., 1948."
9952166769601401,.b10675310,Henry James and the occult; the great extension.,"Bloomington, Indiana University Press [1972]"
9952166779501401,.b10677471,"The men who make our novels, by George Gordon [pseud.]","New York, Moffat, Yard & company, 1919."
9952166801101401,.b10660732,Pour une sociologie du roman.,[Paris] Gallimard [1964]
9952166850701401,.b10657125,Episches Theater.,"Koln, Berlin, Kiepenheuer u. Witsch (1966)"
9952166853501401,.b10677975,The light of common day; realism in American fiction [by] Edwin H. Cady.,"Bloomington, Indiana University Press [1971]"
9952166855701401,.b10677719,"Novelists' America; fiction as history, 1910-1940.","Syracuse, N.Y.] Syracuse University Press [1969]"
9952166890801401,.b1067259x,"Monte Cristo, by Charles Fechter, as played by James O'Neill, & other plays by Julia Ward Howe, George C. Hazelton, Langdon Mitchell [and] William C. De Mille. Edited by J.B. Russak.","Princeton, N.J., Princeton University Press, 1941."
9952166893201401,.b10672357,"The great diamond robbery & other recent melodramas, by Edward M. Alfriend & A.C. Wheeler, Clarence Bennett [and others] ... edited by Garrett H. Leverton.","Princeton, N.J., Princeton University Press, 1940."
9952166912001401,.b1067312x,"A history of the American drama, from the beginning to the civil war, by Arthur Hobson Quinn ...","New York, London, Harper & Brothers, 1923."
9952166914001401,.b10672989,"Fifty years of American drama, 1900-1950.","Chicago, Regnery, 1951."
9952166918801401,.b10674135,"Harold Frederic, by Thomas F. O'Donnell and Hoyt C. Franchere.","New York, Twayne Publishers [1961]"
9952166945901401,.b1065821x,"The critic and the drama, by George Jean Nathan.","New York, A.A. Knopf, 1922."
9952166977101401,.b10699958,The Catholic tradition in English literature / Edited by George Carver.,"Garden City, N.Y. : Doubleday, Page ; 1926."
9952166980501401,.b10699594,"Makers of literature; being essays on Shelley, Landor, Browning, Byron, Arnold, Coleridge, Lowell, Whittier, and others, by George Edward Woodberry ...","New York, The Macmillan company; [etc., etc.] 1900."
9952167007301401,.b1069044x,The poems and plays of William Vaughn Moody; with an introduction by John M. Manly ...,"Boston, New York, Houghton Mifflin Company, 1912."
9952167044401401,.b10682545,The collected essays of John Peale Bishop; ed. with an introd. by Edmund Wilson.,"New York, C. Scribner's Sons, 1948."
9952167073801401,.b10706471,The work of Stephen Crane. Edited by Wilson Follett.,"New York, Russell & Russell [1963]"
9952167076101401,.b10702805,This simian world. With illustrations by the author.,"New York, A.A. Knopf, 1920."
9952167084401401,.b10705508,American humor : a study of the national character / by Constance Rourke.,"New York : Harcourt, Brace and Company, c1931."
