9952174409101401,.b11532233,"The Germans in history, by Prince Hubertus zu Loewenstein.","Columbia University Press,",1945.
9952174415401401,.b11533389,Carolingian portraits; a study in the ninth century.,University of Michigan Press,[1962]
9952174431801401,.b11538296,"A short history of Germany, 1815-1945. Economic sections by W. O. Henderson, and with contributions by C. J. Child and D. C. Watt.","University Press,",1959.
9952174497501401,.b11542433,"Germany speaks, by 21 leading members of party and state. With a pref. by Joachim von Ribbentrop. London, T. Butterworth, 1938.","AMS Press,",1972]
9952174535501401,.b11546384,The plot against the peace; a warning to the nation! By Michael Sayers and Albert E. Kahn.,"Dial Press,",1945.
9952174591701401,.b11572619,"Chronicle and romance; Froissart, Malory, Holinshed. With introductions, notes and illustrations.",P.F. Collier,[c1910]
9952174650001401,.b11544880,"The war against the west, by Aurel Kolnai: with preface by Wickham Steed.","The Viking press,",1938.
9952174657301401,.b11591146,King James VI and I.,Cape,[1956]
9952174660001401,.b11547893,The struggle for democracy in Germany ...,"University of North Carolina Press,",[c1949]
9952174666901401,.b11578324,"Elizabeth I and her Parliaments, 1559-1581.",Cape,[1953]
9952174669801401,.b1157818x,The defeat of the Spanish Armada.,"J. Cape,",[1959]
9952174685501401,.b1157737x,The dangerous queen.,"G. Chapman,",1964.
9952174688001401,.b11573983,The history of Edward the Third (1327-1377),"Longmans, Green,",1900.
9952174705001401,.b11579365,"Cromwell & communism; socialism and democracy in the great English revolution, by Eduard Bernstein, translated by H. J. Stenning.",G. Allen & Unwin,[1930]
9952174757101401,.b11598992,English men and manners in the eighteenth century : an illustrated narrative / by A. S. Turberville.,"Clarendon Press,",1929.
9952174760201401,.b1159858x,"Pitt versus Fox: father & son, 1735-1806; translated by Eric Northcott.","G. Bell,",1950.
9952174764301401,.b11591997,"The works of Gerrard Winstanley, with an appendix of documents relating to the Digger movement, edited with an introduction by George H. Sabine ...","Cornell University Press,",1941.
9952174779601401,.b11590774,"Jacobean pageant; or, The court of King James I.","Harvard University Press,",1962.
9952174780001401,.b11590737,"Court beauties of old Whitehall; historiettes of the restoration, by W. R. H. Trowbridge. With 32 illustrations.","T.F. Unwin,",1906.
9952174811701401,.b11590531,"A history of England principally in the seventeenth century, by Leopold von Ranke.","The Clarendon press,",1875.
9952174845201401,.b11578579,The England of Elizabeth : the structure of society / by A.L. Rowse.,"Macmillan,",1951.
9952174863701401,.b11598281,"England under the restoration (1660-1688) by Thora G. Stone, M.A., with a preface by A.F. Pollard ...","Longmans, Green and Co.,",1923.
9952174864001401,.b11598232,"England in the reign of Charles II, by David Ogg ...","The Clarendon Press,",1934.
9952174864901401,.b11598141,"A supplement to Burnet's History of my own time : derived from his original memoirs, his autobiography, his letters to Admiral Herbert, and his private meditations, all hitherto unpublished / ed. by H. C. Foxcroft.","Clarendon Press,",1902.
9952174867101401,.b11597872,"The Restoration of Charles II, 1658-1660.","Huntington Library,",1955.
9952174873101401,.b11599613,"British statemen of the great war, 1793-1814; the Ford lectures for 1911, by J. W. Fortescue.","The Clarendon press,",1911.
9952174874301401,.b11599492,"Years of victory, 1802-1812, by Arthur Bryant.",Harper & brothers,[1945]
9952174875201401,.b11599388,"The Chatham administration, 1766-1768.",Macmillan;,1956.
9952174877301401,.b1159911x,"England under George I: the beginnings of the Hanoverian dynasty, by Wolfgang Michael. Translated and adapted from the German.","Macmillan,",1936.
9952174881801401,.b11599790,The structure of politics at the accession of George III [by] L.B. Namier ...,"Macmillan and Co., Limited,",1929.
9952174888601401,.b11603161,"The clubs of Augustan London, by Robert J. Allen.","Harvard university press,",1933.
9952174905501401,.b11601814,"The first labour government, 1924.",Chapman & Hall,[1957]
9952174910401401,.b11602363,"The British empire under fire, by James Frederick Green; maps and charts by Bunji Tagawa.",The Foreign policy association,[1940]
9952174933001401,.b11589917,Change and continuity in seventeenth-century England / Christopher Hill.,"Harvard University Press,",1975.
9952175363601401,.b11638564,"Evolution and religion in education, polemics of the fundamentalist controversy of 1922 to 1926, by Henry Fairfield Osborn.","C. Scribner's Sons,",1926.
9952175458001401,.b11636348,Common sense and the fifth amendment.,Criterion Books,[1957]
9952175466101401,.b11638424,"Evolution and Christian faith, by H.H. Lane ...","Princeton University Press,",1923.
9952175468101401,.b11631016,The quest; history and meaning in religion.,University of Chicago Press,[1969]
9952175482101401,.b11636798,Expanding liberties; freedom's gains in postwar America [by] Milton R. Konvitz.,Viking Press,[1966]
9952175514901401,.b11636609,This American people.,Harper,[1951]
9952175533301401,.b1163599x,"Political and civil rights in the United States; a collection of legal and related materials, by Thomas I. Emerson, and David Haber. Foreword by Robert M. Hutchins.","Dennis,",1958.
9952175632201401,.b11634418,"Stoic, Christian, and humanist. [Essays]","Beacon Press,",1950.
9952175771901401,.b11679177,"The study of urbanization, edited by Philip M. Hauser [and] Leo F. Schnore.",Wiley,[1965]
9952175773601401,.b11679098,"The metropolitan problem and American ideas; five lectures delivered on the William W. Cook Foundation at the University of Michigan, March 6-10, 1961.","Knopf,",1962.
9952175943501401,.b11666274,"The Nazi persecution of the churches, 1933-45 [by] J. S. Conway.",Basic Books,[1968]
9952176107701401,.b11688956,India's roots of democracy; a sociological analysis of rural India's experience in planned development since independence [by] Carl C. Taylor [and others],Praeger,"[1966, c1965]"
9952176108401401,.b11688889,The little community; viewpoints for the study of a human whole.,University of Chicago Press,[1955]
9952176109201401,.b11688798,Capitalism and the Chinese peasant; social and economic change in a Hong Kong village [by] Jack M. Potter.,"University of California Press,",1968.
9952176113701401,.b11688506,Peasants in the modern world. Edited by Philip K. Bock.,University of New Mexico Press,[1969]
9952176125301401,.b11690653,Comparative human rights / edited by Richard P. Claude.,"Johns Hopkins University Press,",c1976.
9952176137801401,.b1168835x,The suburban myth.,"Columbia Univ. Press,",1969.
9952176138301401,.b11688270,"Metropolis; a study of urban communities, by Howard Woolston ...",D. Appleton-Century Company incorporated,[c1938]
