9952175725701401,.b11635605,Early medieval theology. Newly translated and edited by George E. McCracken in collaboration with Allen Cabaniss.,Westminster Press,[1957]
9952175745501401,.b11631119,Faith and knowledge.,Cornell University Press,[1966]
9952175751301401,.b11638503,"Science, religion and reality [by] Arthur James, earl of Balfour ... Bronislaw Malinowski ... [and others] edited by Joseph Needham.","The Macmillan company,",1925.
9952175767401401,.b11679426,"Social structure and personality in a city, edited by O. A. Oeser and S. B. Hammond.","Macmillan Co.,",1954.
9952175773201401,.b11679116,The twilight of cities / E.A. Gutkind.,"Free Press of Glencoe,",c1962.
9952175878601401,.b11678896,A single society; alternatives to urban apartheid.,Praeger Publishers,[1969]
9952176013101401,.b11689341,"The loyalty of free men. Foreword by Zechariah Chafee, Jr.","Viking Press,",1951.
9952176016001401,.b11689018,"Rural life in the United States, by Carl C. Taylor [and others.","A. A. Knopf,",1949.
9952176016801401,.b11687794,The States and the urban crisis. [Edited by Alan K. Campbell],Prentice-Hall,[1970]
9952176017101401,.b11687769,"The preindustrial city, past and present.",Free Press,[1960]
9952176116201401,.b11688385,"Crestwood Heights; a study of the culture of suburban life [by] John R. Seeley, R. Alexander Sim [and] Elizabeth W. Loosley. Introd. by David Riesman.",Basic Books,[1956]
9952176117501401,.b11689523,The blessings of liberty.,Lippincott,[1956]
9952176140801401,.b11688014,The challenge of Megalopolis; a graphic presentation of the urbanized northeastern seaboard of the United States. Based on the original study by Jean Gottmann.,"Macmillan,",1964.
9952161395201401,.b10036313,Human rights and world order / edited by Abdul Aziz Said.,"Transaction Books,",c1978.
9952161566301401,.b10056853,English humanists and Reformation politics under Henry VIII and Edward VI.,"Clarendon Press,","1965, 1969 printing."
9952161596101401,.b10046537,The new politics of human rights / James Avery Joyce.,"St. Martin's Press,","1979, c1978."
9952161773601401,.b1008843x,"Editorial research reports on the rights revolution : timely reports to keep journalists, scholars, and the public abreast of developing issues, events, and trends.","Congressional Quarterly,",c1978.
9952161802001401,.b10067115,Kett's rebellion : the Norfolk rising of 1549 / Stephen K. Land.,Boydell Press ;,1977.
9952162052201401,.b10087357,"Religion and science : conflict and synthesis, some philosophical reflections.","S.P.C.K.,",1964.
9952162464801401,.b10170777,An introduction to the phonetics of American English/ by Charles Kenneth Thomas.,Ronald Press Co.,[1947]
9952162474901401,.b10167067,Language and control / Roger Fowler ... [et al.].,"Routledge & K. Paul,",1979.
9952162642201401,.b10166506,Philosophical theology.,"The University Press,","1928-30, 1968 printing."
9952163014201401,.b10218944,"Tudor studies : Presented by the Board of Studies in History in the University of London to Albert Frederick Pollard, being the work of twelve of his colleagues and pupils. Edited by R. W. Seton-Watson.","Books for Libraries,",1969.
9952163144501401,.b10216418,"The Newtonians and the English Revolution, 1689-1720 / Margaret C. Jacob.","Cornell University Press,",1976.
9952163155601401,.b10261898,Measuring growth in English / Paul B. Diederich.,,[1974]
9952163364301401,.b10283201,"Nonverbal communication; notes on the visual perception of human relations, by Jurgen Ruesch and Weldon Kees.","University of California Press,",1956.
9952163370801401,.b10279349,The Cardinal and the Secretary : Thomas Wolsey and Thomas Cromwell / Neville Williams.,,"1976, c1975."
9952163824401401,.b10306419,Le Langage a l'âge classique / Andre Robinet.,"Klincksieck,",1978.
9952164099901401,.b10337131,"The Bloomsbury group : a collection of memoirs, commentary, and criticism / edited by S. P. Rosenbaum.","University of Toronto Press,",c1975.
9952164116201401,.b10334233,Histoire de la langue francaise cultivee des origines a nos jours.,A. Jullien,[1959]
9952164152801401,.b10332157,Problemes de linguistique generale.,"Gallimard,",1966-74.
9952164486001401,.b10397632,Language in America / Charlton Laird.,"Prentice-Hall,",1972.
9952166174401401,.b10601387,The history of England from the restoration to the death of William III. (1660-1702) by Richard Lodge.,"Longmans, Green",1910.
9952166177001401,.b10601090,Political activities of the Baptists & Fifth monarchy men in England during the interregnum.,"Amer. historical assoc.,","1912, c1913."
9952167301001401,.b10747539,Proceedings of the Short Parliament of 1640 / edited for The Royal Historical Society by Esther S. Cope in collaboration with Willson H. Coates.,"Offices of the Royal Historical Society University College London,",1977.
9952167458101401,.b10772480,The honeymoon; a comedy in three acts.,G. H. Doran Company,[c1912]
9952167837001401,.b10770902,Echoes of the war / by J.M. Barrie.,"Scribner's,",1919 [c1918]
9952168384701401,.b10859421,A civil tongue / by Edwin Newman.,"Warner Books,",1976.
9952168871901401,.b10909205,Modern language classroom techniques; a handbook [by] Edward David Allen [and] Rebecca M. Valette.,Harcourt Brace Jovanovich,[1972]
9952168873901401,.b1090900x,Language and society / by Joseph Bram.,"Random House,",c1955.
9952168955801401,.b10917160,"Human speech; some observations, experiments, and conclusions as to the nature, origin, purpose and possible improvement of human speech, by Sir Richard Paget, bart.","K. Paul, Trench, Trubner & co., ltd.;",1930.
9952168962101401,.b10923962,The structure of complex words.,"Chatto and Windus,",1951.
9952168973201401,.b10918504,"Language, its nature, development and origin / by Otto Jespersen.","Allen & Unwin,",1922.
9952168973501401,.b10918474,"Proto-Romance phonology / Robert A. Hall, Jr.","Elsevier,",c1976.
9952169015701401,.b10906514,"Language in action : a guide to accurate thinking, reading and writing / S.I. Hayakawa.","Harcourt, Brace and company,",1941.
9952169017401401,.b10906435,Words and things.,The Free Press,[1958]
9952169020001401,.b10906307,"An introduction to descriptive linguistics / by H.A. Gleason, Jr.","Holt, Rinehart and Winston,",1961.
9952169036101401,.b10919934,"The word irony and its context, 1500-1755 / Norman Knox.","Duke University Press,",1961.
9952169067201401,.b10937006,The story of English / by Mario Pei.,"Lippincott,",c1952.
9952169089001401,.b10918826,"The handwriting of the renaissance, by Samuel A. Tannenbaum; being the development and characteristics of the script of Shakspere's time, with an introduction by Ashley H. Thorndike ...","Columbia university press,",1930.
9952169090701401,.b10918632,"The philosophy of grammar, by Otto Jespersen.",G. Allen & Unwin;,[1924]
9952169131001401,.b1092517x,All-American English / J. L. Dillard.,"Random House,",[1975]
9952169292701401,.b10933451,"Double-speak in America, by Mario Pei.",Hawthorn Books,[1973]
9952169293001401,.b10933426,"Field techniques in an urban language study [by] Roger W. Shuy, Walter A. Wolfram [and] William K. Riley.","Center for Applied Linguistics,",1968.
9952171117001401,.b11371985,Victorian England : portrait of an age / G. M. Young.,"Oxford University Press,",1977.
9952171722001401,.b10960739,Franklin's Vocabulary / by Lois Margaret MacLaurin.,"Doubleday, Doran,",1928.
9952171742201401,.b10965841,"The structure of American English. With a chapter on American English dialects by Raven I. McDavid, Jr.",Ronald Press Co.,[1958]
9952171884601401,.b10990574,"Comprehending technical Japanese / Edward E. Daub, R. Byron Bird, Nobuo Inoue.","University of Wisconsin Press,",1975.
9952171895701401,.b10991372,The undergraduate curriculum.,"The Modern Language Association of America,",c1975.
9952172347601401,.b11012985,A pronouncing dictionary of American English / by John Samuel Kenyon and Thomas Albert Knott.,"G. & C. Merriam,",c1944.
9952174198801401,.b11509594,"Documents and speeches on British Commonwealth affairs, 1931-1952.","Oxford University Press,",1953.
9952174199101401,.b11509569,"Documents and speeches on Commonwealth affairs, 1952-1962.","Oxford University Press,",1963.
9952174264201401,.b11531678,"The Reichswehr and the German Republic, 1919-1926.","Princeton University Press,",1957.
9952174356101401,.b11541751,"Germany between two wars, a study of propaganda and war-guilt [by] Lindley Fraser.","Oxford university press,",1945.
9952174363501401,.b11544272,"Germany enters the third reich, by Calvin B. Hoover ...","The Macmillan Company,",1933.
9952174370401401,.b11545537,"German-French unity, basis for European peace.","H. Regnery Co.,",1957.
9952174433601401,.b11538041,What is wrong with Germany? By William Harbutt Dawson ...,"Longmans, Green and Co.,",1915.
9952174506901401,.b11539045,"Bismarck in the Franco-German war, 1870-1871. Authorized translation from the German of Dr. Moritz Busch.",C. Scribner's sons,[1879]
9952174512501401,.b11540138,"Army, industry, and labor in Germany, 1914-1918, by Gerald D. Feldman.","Princeton University Press,",1966.
9952174517101401,.b11539689,"Germany before the war, by Baron Beyens ... Tr. by Paul V. Cohn ...","T. Nelson and Sons, Ltd.",[1916]
9952174537101401,.b11546190,The voice of destruction. By arrangement with Alliance book corporation.,Putnam,[c1940]
9952174537901401,.b11534400,"History of Frederick the Second, called Frederick the Great. By John S. C. Abbott.","Harper & Brothers,",1871.
9952174546901401,.b1153655x,The fall of Stein [by] R.C. Raack.,"Harvard University Press,",1965.
9952174548401401,.b11537590,"The founding of the German empire by William I. Based chiefly upon Prussian state documents; by Heinrich von Sybel. Tr. by Marshall Livingston Perrin. Assisted by Gamaliel Bradford, jr.",T. Y. Crowell & co.,[1890-98]
9952174572701401,.b11571779,Edward the Confessor.,"University of California Press,",1970.
9952174650301401,.b11544831,"Hitler and beyond, a German testament, by Erich Koch-Weser, translated by Olga Marx ...","A.A. Knopf,",1945.
9952174653901401,.b11591596,A coffin for King Charles; the trial and execution of Charles I [by] C. V. Wedgwood.,Macmillan,[1964]
9952174654401401,.b11591535,"Left-wing democracy in the English Civil War; a study of the social philosophy of Gerrard Winstanley, by David W. Petegorsky.","V. Gollancz Ltd.,",1940.
9952174676001401,.b11574173,"Richard II, by Anthony Steel ... With a foreword by G.M. Trevelyan.",The University press,[1941]
9952174684501401,.b11577496,Elizabeth I and the Puritans.,Published for the Folger Shakespeare Library [by] Cornell University Press,[1964]
9952174689101401,.b11573867,"The thirteenth century, 1216-1307.","Clarendon Press,",1953.
9952174703401401,.b11579535,"The early Stuarts, 1603-1660.","Clarendon Press,",1959.
9952174704101401,.b11579468,"The later Stuarts, 1660-1714.","Clarendon Press,",1955.
9952174763601401,.b11592060,The greatness of Oliver Cromwell.,Hodder and Stoughton,[1957]
9952174767201401,.b11601449,"Victorian England; portrait of an age, by G.M. Young ...","Oxford University Press, H. Milford,",1936.
9952174864301401,.b11598207,"The first Whigs; the politics of the Exclusion Crisis, 1678-1683.","Oxford University Press,",1961.
9952174894201401,.b11600779,"British conservatism, 1832-1914.",Faber and Faber [1959],
9952174902701401,.b11602119,"In search of peace, by the Rt. Hon. Neville Chamberlain, M.  P., prime minister of Great Britian.",G. P. Putman's sons,[c1939]
9952174906001401,.b11601760,Why England slept.,W. Funk,[1961]
9952174907101401,.b11601589,"Britain in the century of total war; war, peace, and social change, 1900-1967.","Little, Brown",[1968]
9952174908101401,.b11602661,"Socialist Britain: its background, its present and an estimate of its future.","Viking Press,",1949 [c1948]
9952174912001401,.b11602193,No cause for alarm.,Harper,[1949]
9952175472101401,.b11630991,"Religion, its functions in human life; a study of religion from the point of view of psychology by Knight Dunlap ...","McGraw Hill Book Company, inc.,",1946.
9952175472901401,.b11636841,National security and individual freedom.,"McGraw-Hill,",1950.
9952175488301401,.b11639829,The story of the Bible; written and drawn by Hendrik Willem Van Loon.,Boni & Liveright,[c1923]
9952175497501401,.b11636701,The liberal spirit; essays on problems of freedom in the modern world.,"Cornell Univ. Press,",1948.
9952175501501401,.b11639222,The Cambridge history of the Bible.,"University Press, 1963-70. [v. 1, 1970; v.","3, 1963]"
9952175506801401,.b11639192,"The English Bible; a history of translations from the earliest English versions to the New English Bible, by F. F. Bruce.","Oxford University Press,",1970.
9952175526601401,.b11636026,"The individual, the state and world government, by A.C.Ewing.","The Macmillan Company,",1947.
9952175537901401,.b11636488,The Christian centuries from Christ to Dante [by] Robert Payne.,Norton,[1966]
9952175577701401,.b11634765,Current problems in religion.,Philosophical Library,[1956]
9952175649301401,.b11631284,"Beyond tragedy; essays on the Christian interpretation of history, by Reinhold Niebuhr.","C. Scribner's Sons,",1937.
9952175716301401,.b11635897,"Institutes of the Christian religion. Edited by John T. McNeill. Translated by Ford Lewis Battles, in collaboration with the editor and a committee of advisers.",Westminster Press,[c1960]
9952175717301401,.b11635861,Melanchthon and Bucer.,Westminster Press,[1969]
9952175721801401,.b11635745,"Advocates of reform, from Wyclif to Erasmus.",Westminster Press,[1953]
9952175747401401,.b11636385,American religious thought : a history / William A. Clebsch.,"University of Chicago Press,",1973.
9952175769101401,.b11679311,The medieval town [by] John H. Mundy and Peter Riesenberg.,Van Nostrand,[1958]
9952176015401401,.b11689080,Rural Mexico; with a foreword by Manuel Gamio.,Univ. of Chicago Press,[1948]
9952176015701401,.b11689043,Modern homesteaders.,"Belknap Press of Harvard University Press,",1955.
9952176110301401,.b11688737,"Social structure and personality in a rural community, by O. A. Oeser and F. E. Emery.","Macmillan,",1954.
9952176113801401,.b1168981x,Civil liberties in the United States; a guide to current problems and experience.,Cornell University Press,[1956]
9952176115101401,.b11688452,"Home town, by Sherwood Anderson; photographs by Farm Security Photographers.",Alliance Book Corporation,[c1940]
9952176141301401,.b11687952,Urbanization in Latin America; proceedings. Edited by Philip M. Hauser.,"International Documents Service,",1961.
9952160792901401,.b10017574,"Country and court : England, 1658-1714 / J. R. Jones.","Harvard University Press,",1978.
9952160806501401,.b10026629,Weasel words : the art of saying what you don't mean / by Mario Pei.,"Harper & Row,",c1978.
9952161788301401,.b10079063,Philosophers speak of God / by Charles Hartshorne and William L. Reese.,"University of Chicago Press,","1953, 1976 printing."
9952162037201401,.b10088581,The Human rights reader / edited by Walter Laqueur and Barry Rubin.,"New American Library,",[1979]
9952162601001401,.b10176536,Respectable folly : millenarians and the French Revolution in France and England / Clarke Garrett.,,[1975]
9952162639701401,.b10171782,Liberty and language / Geoffrey Sampson.,"Oxford University Press,",1979.
9952163025701401,.b1021785x,"War in medieval English society; social values in the Hundred Years War, 1337-99.",,[1974]
9952163158101401,.b10252964,Theories du symbole / Tzvetan Todorov.,"Editions du Seuil,",c1977.
9952168525901401,.b10843292,"Multilingual lexicon of linguistics and philology : English, Russian, German, French / Rose Nash ; consultants: Mervin Alleyne, Gerd Fraenkel, Stephen Soudakoff.","University of Miami Press,",c1968.
9952168872501401,.b1090914x,Dictionnaire encyclopedique des sciences du langage [par] Oswald Ducrot [et] Tzvetan Todorov.,Editions du Seuil,[1972]
9952169015201401,.b1090654x,Leave your language alone!,"Linguistica,",1950.
9952169280401401,.b11184097,"The times of Saint Dunstan; the Ford lectures delivered in the University of Oxford in the Michaelmas term, 1922, by J. Armitage Robinson ...","The Clarendon Press,",1923.
9952169550601401,.b1118775x,The Stuarts: a study in English kingship [by] J. P. Kenyon.,"Fontana,",1971.
9952170076201401,.b11250884,The Goths in the Crimea [by] Alexander Alexandrovich Vasiliev.,"The Mediaeval academy of America,",1936.
9952171164401401,.b11373167,"Social problems and policy during the Puritan revolution, 1640-1660.","Barnes & Noble,",1966.
9952171872601401,.b1098964x,Textos linguisticos del medioevo español; preparados con  introducciones y glosario por D. J. Gifford y F. W. Hodcroft.,"Dolphin Books Co.,",1966 [i.e.1967]
9952172961101401,.b1112281x,Germany : 2000 years.,F. Ungar Pub. Co.,[1961]
9952173118401401,.b11132942,"A short history of Germany, by Ernest F. Henderson.",The Macmillan Company;,1902.
9952174265601401,.b11531526,"History of the German General Staff, 1657-1945. Translated by Brian Battershaw. Introd. by Walter Millis.",Praeger,[1953]
9952174366801401,.b11546128,"The revolution of nihilism; warning to the West, by Hermann Rauschning.","Alliance Book Corporation,",[c1939]
9952174496901401,.b11542500,"Hitler and the Beer Hall Putsch [by] Harold J. Gordon, Jr.","Princeton University Press,",1972.
9952174534601401,.b1154644x,"Germany will try it again, by Sigrid Schultz.",Reynal & Hitchcock,[1944]
9952174765401401,.b11591870,"The Leveller tracts, 1647-1653, edited by William Haller ... and Godfrey Davies ...","Pub. by Columbia University Press in cooperation with Henry E. Huntington Library and Art Gallery,",1944.
9952174767901401,.b1160136x,Cobden and Bright: a Victorian political partnership.,"St. Martin's Press,",1968 [c1967]
9952174863101401,.b11598335,England in the reigns of James II and Wiiliam III.,"Clarendon Press,",1955.
9952174879201401,.b11600135,"The reign of George III, 1760-1815.","Clarendon Press,",1960.
9952174880401401,.b11599996,King George III and the politicians.,Clarendon Press,1953.
9952174893701401,.b11600834,"Gladstone and Palmerston; being the correspondence of Lord Palmerston with Mr. Gladstone, 1851-1865. Edited with an introd. and commentary by Philip Guedalla.","Harper,",1928.
9952174903501401,.b11602028,"English history, 1914-1945 [by] A.J.P. Taylor.","Oxford University Press,",1965.
9952174907301401,.b11601565,Twentieth-century Britain.,"Row, Peterson",[1962]
9952175475201401,.b11639349,The authority of the Bible / C. H. Dodd.,"Harper,","[1962, c1960]"
9952175482201401,.b11636221,"The relations between freedom and responsibility in the evolution of democratic government, by Arthur Twining Hadley ...","C. Scribner's sons,",1903.
9952175485701401,.b11630905,"The psychology of religious awakening, by Elmer T. Clark.","Macmillan,",1929.
9952175505301401,.b11639209,"The literary lineage of the King James Bible, 1340-1611.","Octagon Books,",1971 [c1941]
9952175641401401,.b11637638,Deism in eighteenth century America.,"Columbia university press,",1934.
9952176016201401,.b11688993,Rural life in Argentina.,"Louisiana State Univ. Press,",1948.
9952176138001401,.b11688324,Working-class suburb; a study of auto workers in suburbia.,"University of California Press,",1960.
9952176141001401,.b11687988,"The urban South [by] Rupert B. Vance and Nicholas J. Demerath, editors, with the assistance of Sara Smith and Elizabeth M. Fink.","University of North Carolina Press,",1954.
9952160808801401,.b10026344,Puritans and revolutionaries : essays in seventeenth-century history presented to Christopher Hill / edited by Donald Pennington and Keith Thomas.,"Clarendon Press,",1978.
9952161425001401,.b10016314,Death of a utopia : the development and decline of student movements in Europe / by Gianni Statera.,"Oxford Univ. Press,",1975.
9952161481901401,.b10038875,The rights of man today / Louis Henkin.,"Westview Press,",1978.
9952161621501401,.b10043573,Edward IV / Charles Ross.,,1974.
9952161671901401,.b10062385,London in the Age of Reform / edited by John Stevenson.,"Blackwell,",1977.
9952162180201401,.b10147871,Human rights and American foreign policy / edited by Donald P. Kommers and Gilburt D. Loescher.,"University of Notre Dame Press,",c1979.
9952162263101401,.b10128918,The meaning and end of religion / Wilfred Cantwell Smith ; foreword by John Hick.,"Harper & Row,",1978.
9952162807401401,.b10186748,Linguistics and literary theory / Karl D. Uitti.,,1969.
9952163184801401,.b10263470,"New horizons in linguistics, edited by John Lyons.",,1970.
9952163524601401,.b10268145,The learning of language / edited by Carroll E. Reed.,Appleton-Century-Crofts,[1971]
9952163632201401,.b10280285,A survey of psycholinguistics. [By] Susan H. Houston.,"Mouton,",1972.
9952163853601401,.b10332030,"Syntaxe du francais moderne : ses fondements historiques et psychologiques / Georges Le Bidois, Robert Le Bidois.","A. Picard,",1967.
9952164124101401,.b10335584,The debate on the English Revolution / R. C. Richardson.,"St. Martin's Press,",1977.
9952164598801401,.b10410478,Semantics : an introduction to the science of meaning / by Stephen Ullmann.,"Barnes and Noble,",1979.
9952166578801401,.b10648331,"George I, elector and king / Ragnhild Hatton.","Harvard University Press,",1978.
9952167460401401,.b10772248,"The plays of Beaumont and Fletcher; an attempt to determine their respective shares and the shares of others, by E. H. C. Oliphant.",Yale university press;,1927.
9952167691501401,.b10773022,"Overture--1920, a play, foreword by Gabriel Beer-Hofmann.","Simon and Schuster,",1931.
9952167700801401,.b10772534,"The love match; a play in five scenes, by Arnold Bennett ...",George H. Doran company,[c1922]
9952167721501401,.b10769663,Come of age: the text of a play in music and words by Clemence Dane [pseud.] and Richard Addinsell.,"Doubleday, Doran & company, inc.,",1934.
9952167837401401,.b10770860,Dear Brutus; a comedy in three acts.,"C. Scribner's Sons,",1922.
9952168871201401,.b1090928x,Foreign language instruction; dimensions and horizons [by] Ruth R. Cornfield.,Appleton-Century-Crofts,[1966]
9952168967501401,.b10920183,"The loom of language, by Frederick Bodmer.",Norton,[1944]
9952169033901401,.b10919971,Elements of lexicology and semiotics. [Translated by Iain Taylor],"Mouton,",1973.
9952169058701401,.b1093554x,British and American English since 1900 / by Eric Partridge and John W. Clark.,"Philosophical Library,",1951.
9952169089201401,.b10918796,"The craft & context of translation, a symposium. Edited by William Arrowsmith and Roger Shattuck.","Published by University of Texas Press for Humanities Research Center,",[1961]
9952169089401401,.b10918772,"External history of the Romance languages [by] Robert A. Hall, Jr.",American Elsevier Pub. Co.,[1974]
9952169090001401,.b10918711,Linguistics across cultures; applied linguistics for language teachers. With a foreword by Charles C. Fries.,University of Michigan Press,[1957]
9952169294301401,.b10933281,A short introduction to English grammar.,"Scott, Foresman",[1959]
9952169335201401,.b10930486,"Semantic frequency list for English, French, German, and Spanish : a correlation of the first six thousand words in four single-language frequency lists / compiled by Helen S. Eaton.","University of Chicago Press,",c1940.
9952169503001401,.b11174377,"A modern history of the English people, by R. H. Gretton.","G. Richards ltd.,",1913-[29]
9952169561501401,.b11200194,"The Anti-Corn Law League, 1838-1846/ Norman McCord","Allen & Unwin,",[1958]
9952170839001401,.b11327522,"The ""invincible"" Armada and Elizabethan England / by Garrett Mattingly.","Folger Shakespeare Library,","1979, c1963."
9952171083901401,.b11372837,The Renaissance and Reformation in Germany : an introduction / edited by Gerhart Hoffmeister.,"F. Ungar Pub. Co.,",c1977.
9952171532401401,.b10963200,New rhyming dictionary and poets' handbook.,"Harper,",1931.
9952171804901401,.b10989808,"Latin epigraphy; an introduction to the study of Latin inscriptions, by Sir John Edwin Sandys.","The University Press,",1927.
9952171875501401,.b10993800,"Comparative grammar of Greek and Latin, by Carl Darling Buck ...",The University of Chicago press,[c1933]
9952171951101401,.b10980891,Cantonese primer.,Greenwood Press,"[1969, c1947]"
9952174159201401,.b11525940,"Exeter, 1540-1640; the growth of an English county town.","Harvard University Press,",1958.
9952174161501401,.b1152554x,"The plague in Shakespeare's London, by F. P. Wilson.","The Clarendon press,",1927.
9952174186901401,.b11524716,"London; an illustrated history, by Ivor Brown.","Studio Vista,",[1965]
9952174187401401,.b11524650,"The growth of Stuart London, by Norman G. Brett-James with a foreword by Alderman Sir Charles H. Collett, bart., London & Middlesex Archaeological Society.","G. Allen & Unwin, ltd.",[1935]
9952174187701401,.b11524625,Peace in Piccadilly; the story of Albany.,Reynal,[1958]
9952174188601401,.b11524509,"Medieval London, by Sir Walter Besant.","A. & C. Black,",1906.
9952174252901401,.b11531253,"The German record, a political portrait, by William Ebenstein.","Farrar & Rinehart, Inc.",[1945]
9952174254101401,.b11531101,The origins of modern Germany / by G. Barraclough.,"Capricorn Books,",1963.
9952174268301401,.b11533109,"Germany in the early middle ages, 476-1250. Ed. by Arthur Hassall.  With two maps.","Longmans, Green and Co.,",1908.
9952174281101401,.b11525009,"The livery companies of the city of London; their origin, character, development, and social and political importance. By W. Carew Hazlitt ... With two coloured plates and numerous illustrations.",S. Sonnenschein & co.;,1892.
9952174407801401,.b11532397,The little dictators : the history of Eastern Europe since 1918 / Antony Polonsky.,"Routledge & K. Paul,",1975.
