9952168216001401,.b10820735,"The laureate of pessimism: a sketch of the life and character of James Thomson (""B.V."") ... By Bertram Dobell.","The author,",1910.
9952168219801401,.b10821430,Thomas Traherne / by Gladys I. Wade ; with a selected bibliography of criticism by Robert Allerton Parker.,"Princeton University Press,","1946, c1944."
9952168225301401,.b10822549,"A choice of emblemes, by Geffrey Whitney, 1548-1601. Edited by Henry Green. With an introd. by Frank Fieler.",B. Blom,[1967]
9952168226401401,.b10824856,"A study of Wordsworth, by J.C. Smith.","Oliver and Boyd,",1946.
9952168257901401,.b10839665,"An American garland, being a collection of ballads relating to America, 1563-1739; ed. with introduction and notes by C. H. Firth.","B.H. Blackwell,",1915.
9952168351901401,.b10817116,The sin of wit; Jonathan Swift as a poet.,Syracuse University Press,[c1950]
9952168428301401,.b10843802,"Chief British poets of the fourteenth and fifteenth centuries; selected poems, ed. with explanatory and biographical notes by W. A. Neilson ... and K. G. T. Webster ...",Houghton Mifflin company,[c1916]
9952168442101401,.b10840333,English lyrical poetry from its origins to the present time.,"Yale Univ. Pr.,",1912.
9952168511401401,.b1084434x,The three Wartons.,"The Scholartis press,",1927.
9952168514301401,.b10842937,"The bronze treasury; an anthology of 81 obscure English poets together with their biographical portraits, edited by Harry Kemp.","The Macaulay Company,",1927.
9952168521901401,.b10843541,"A book of poems for every mood, edited by Harriet Monroe and Morton Dauwen Zabel.",Whitman Pub. Co.,[1933]
9952168523201401,.b10843462,"The dimensions of poetry, a critical anthology; [edited by] James E. Miller, Jr. and Bernice Slote.","Dodd, Mead,",1962.
9952169560201401,.b11200339,Hulbert's history of Korea / edited by Clarence Norwood Weems.,"Hillary House Publishers,",1962.
9952169560601401,.b11200297,The mandate of heaven: record of a civil war; China 1945-49 [by] John F. Melby; photos. by Henri Cartier-Bresson.,"University of Toronto Press,",1968.
9952169595601401,.b11199763,No secret is safe : behind the bamboo curtain / Father Mark Tennien.,"Farrar, Straus and Young,",1952.
9952169815601401,.b11225245,"The Communist conquest of China; a history of the Civil War, 1945-1949. Translated from the French by Timothy Osato and Louis Gelas.","Harvard University Press,",1965.
9952172014301401,.b11018598,A turning wheel : three decades of the Asian revolution as witnessed by a correspondent for The New Yorker / by Robert Shaplen.,"Random House,",c1979.
9952172569301401,.b11072994,"Early sixteenth century lyrics, ed. by Frederick Morgan Padelford.","D. C. Heath & co.,",1907.
9952172569801401,.b11072970,"Toward an Augustan poetic; Edmund Waller's ""reform"" of English poetry.",University of Kentucky Press,[c1962]
9952172601501401,.b11073287,"Rare poems of the seventeenth century, chosen & edited by L. Birkett Marshall.","University Press,",1936.
9952172608201401,.b11073111,A book of Elizabethan lyrics; selected and ed. by Felix E. Schelling.,"Ginn & company,",[c1895]
9952172827301401,.b11085988,"Studies in Spenser's historical allegory, by Edwin Greenlaw.",The Johns Hopkins press;,[c1932]
9952172956301401,.b11119640,"Great plays : English / by Marlowe, Jonson, Fletcher, Sheridan, Payne, and Browning ; with biographical notes and a critical introduction by Joseph O'Connor.","D. Appleton,",1904.
9952173770601401,.b11479917,"The Balkans; a history of Bulgaria, Serbia, Greece, Rumania, Turkey, by Nevill Forbes, Arnold J. Toynbee, D. Mitrany, D.G. Hogarth.","AMS Press,",1970.
9952174555401401,.b11565780,The religion of the Psalms.,University of Chicago Press,[c1922]
9952174616001401,.b11563278,"Literary criticism of the Old Testament, by Norman C. Habel.",Fortress Press,[1971]
9952174751001401,.b11562316,Gideon and the judges; a study historical and practical.,Revell,[1890]
9952174751601401,.b11562250,"The minor prophets, by Rev. F.W. Farrar.",Fleming H. Revell,[189-?]
9952175191801401,.b11625442,Greece today; the aftermath of the refugee impact [by] Eliot Grinnell Mears ...,Stanford University Press;,1929.
9952175192101401,.b11625405,"The Greek miracle, by Stephen Lavra. Translated with a foreword by David Walker.",Hastings House,[1943]
9952175196201401,.b11625065,"A history of Greece, from its conquest by the Romans to the present time, B.C. 146 to A.D. 1864; by George Finlay, LL. D.","Clarendon press,",1877.
9952175221301401,.b11626136,"Byzantine civilisation, by Steven Runciman ...","E. Arnold & co.,",[1933]
9952175223301401,.b11423389,In the People's Republic : an American's first-hand view of living and working in China / Orville Schell.,"Random House,",c1977.
9952175361201401,.b11652135,"Far Eastern front, by Edgar Snow.",H. Smith & R. Haas,[c1933]
9952175461501401,.b11646949,The rise of modern China [by] Immanuel C. Y. Hsu.,"Oxford University Press,",1970.
9952175473201401,.b11628042,The politics of the Balkans.,"McGraw-Hill book company, inc.,",1939.
9952175480001401,.b11636816,"Japan's case examined, with supplementary chapters on the Far Eastern policies of the United States, and the significance to the world of the conflict in the Far East, by Westel W. Willoughby.","The Johns Hopkins Press,",1940.
9952175481201401,.b11628005,New era in Eastern Europe?,Foreign Policy Association,[1957]
9952175486901401,.b11639830,"China: new age and new outlook, by Ping-chia Kuo.","Knopf,",1956.
9952175526701401,.b11639635,"A new digest of Japanese war conduct, compiled by Shuhsi Hsu. Prepared under the auspices of the Council of international affairs, Chungking.","Kelly & Walsh, limited,",1941.
9952175529201401,.b11630644,The Far East since 1500 / by Paul E. Eckel.,"Harcourt, Brace and Company,","1948, c1947."
9952175536501401,.b11645866,Chinese traditional historiography.,"Harvard university press,",[c1938]
9952175538201401,.b11627256,"The diplomacy of the Balkan wars, 1912-1913 [by] Ernst Christian Helmreich ...",Harvard University Press;,1938.
9952175573401401,.b11648144,China's Red masters; political biographies of the Chinese Communist leaders.,Twayne Publishers,[1951]
9952175589501401,.b11637900,"China's destiny, by Chiang Kai-shek; authorized translation by Wang Chung-hui ... with an introduction by Lin Yutang.","The Macmillan Company,",1947.
9952175599201401,.b11648600,Communist China --continuing revolution.,Foreign Policy Association.,1962.
9952175625601401,.b11651088,"The Canadian born in the United States; an analysis of the statistics of the Canadian element in the population of the United States, 1850 to 1930, by Leon E. Truesdell ...",Yale University Press;,1943.
9952175629201401,.b11652354,"The Lords commissioners of trade and plantations, commonly known as the Board of trade, 1748-1782.","Yale University Press,",1925.
9952175632101401,.b11652342,"The fight for Korea; from the war of 1950 to the Pueblo incident, by T.R. Fehrenbach.",Grosset & Dunlap,[1969]
9952175632801401,.b11651593,On the soil of Israel: Americans and Canadians in agriculture.,Association of Americans and Canadians in Israel,[1965]
9952175648201401,.b1164770x,"Strangers at the gate; social disorder in South China, 1839-1861 [by] Frederic Wakeman, Jr.",University of California Press,[c1966]
9952175697401401,.b11645167,The multi-state system of ancient China.,Shoe String Press,[c1953]
9952175699401401,.b11644977,The Chinese in Southeast Asia.,"Oxford University Press,",1951.
9952175711501401,.b11637109,"Two years with the Chinese Communists, by Claire and William Band.","Yale Univ.Press,",1948.
9952175719801401,.b11635794,The situation in Asia.,"Little, Brown,",1949.
9952175721201401,.b11628583,"The guardians of the gate; historical lectures on the Serbe, by R. G. D. Laffan, with a foreword by Vice-Admiral E. T. Troubridge.","Clarendon Press,",1918.
9952175728501401,.b11629551,The Book of human destiny.,Harper,[1948-
9952175798201401,.b11669615,"The old colonial system, 1660-1754, by George Louis Beer ...","The Macmillan company,",1912.
9952175807001401,.b11672158,"The immigration problem; a study of American immigration conditions and needs, by Jeremiah W. Jenks ... and W. Jett Lauck ...","Funk & Wagnalls Co.,",1922.
9952175810101401,.b1167183x,"New homes for old, by S.P.Breckinridge...","Harper & brothers,",1921.
9952175811601401,.b11670149,British colonial policy in the age of Peel and Russell [by] W. P. Morrell.,The Clarendon Press,1930.
9952175903901401,.b11671051,"Europe on the move; war and population changes, 1917-47.","Columbia Univ. Press,",1948.
9952175911201401,.b11670320,"The rise and fall of Germany's colonial empire, 1884-1918, by Mary Evelyn Townsend ... With an introd. by Carlton J.H. Hayes.",Macmillan,1930.
9952175912701401,.b11670241,"The British Empire, its structure and spirit, 1497-1953.","Harvard University Press,",1956.
9952175934701401,.b11672298,"Brothers under the skin, by Carey McWilliams ...","Little, Brown and Company,",1943.
