9952162935501401,.b10202201,"Dictionary of Ming biography, 1368-1644 / the Ming Biographical History Project of the Association for Asian Studies ; L. Carrington Goodrich, editor, Chaoying Fang, associate editor.","Columbia University Press,",1976.
9952165015101401,.b10446357,China and the search for happiness : recurring themes in four thousand years of Chinese cultural history / Wolfgang Bauer ; translated from the German by Michael Shaw.,"Seabury Press,",1976.
9952167099201401,.b10690219,Form and convention in the poetry of Edmund Spenser; selected papers from the English Institute. Edited with a foreword by William Nelson.,"Columbia University Press,",1961.
9952167583601401,.b10757491,"Ruins and visions; poems, 1934-1942, by Stephen Spender.",Random House,[1942]
9952167709201401,.b10767733,"Foreign influences in Elizabethan plays, by Felix E. Schelling ...","Harper & Brothers,",1923.
9952167713201401,.b10767319,Biblical drama in England: from the Middle Ages to the present day.,"Northwestern University Press,",1968.
9952167975401401,.b10805163,"Representative modern plays; British and American, from Robertson to O'Neill, edited by Richard A. Cordell ...","T. Nelson & Sons,",1929.
9952168100701401,.b10807287,"Typical Elizabethan plays, by contemporaries and immediate successors of Shakespeare.",Harper,[1949]
9952168151201401,.b10806076,"Modern British dramas, edited by Harlan Hatcher ...","Harcourt, Brace and Company,",1941.
9952168186401401,.b10840564,"A book of ballads, old and new.",H. Holt and Company,[c1917]
9952168317501401,.b10831551,Spenser's image of nature; wild man and shepherd in The faerie queene.,"Yale University Press,",1966.
9952168443301401,.b10840217,"The middle English penitential lyric; a study and collection of early religious verse, by Frank Allen Patterson, PH. D.","The Columbia University Press,",1911.
9952168524901401,.b10841556,Come hither : a collection of rhymes and poems for the young of all ages / made by Walter De la Mare ; and embellished by Alec Buckels.,"Knopf,",c1928.
9952168647001401,.b10862572,"Chief modern poets of England and America, selected and edited by Gerald De Witt Sanders and John Herbert Nelson.","The Macmillan company,",1943.
9952169790701401,.b11221914,"The book of modern Catholic verse, compiled by Theodore Maynard.",H. Holt and company,[c1926]
9952170267301401,.b11282642,The beginnings of modern colonization; eleven essays with an introduction [by] Charles Verlinden. Translated by Yvonne Freccero.,Cornell University Press,[1970]
9952172603701401,.b11073226,"The Oxford book of sixteenth century verse, chosen by E. K. Chambers.","The Clarendon press,",1932.
9952174481801401,.b11561713,I will be your God; a layman's guide to Old Testament study [by] John H. Otwell.,Abington Press,[1967]
9952174727001401,.b11566899,"The lyric Psalter; the modern reader's book of Psalms, edited by Harry H. Mayer.",Liveright Publishing Corporation,[c1940]
9952175073101401,.b11626069,"Procopius, with an English translation by H.B. Dewing.",Harvard University Press;,"1953-62 [v.l, 1961]"
9952175368701401,.b11633591,The great terror; Stalin's purge of the thirties.,Macmillan,[1968]
9952175482901401,.b11640881,"When Japan fights, by Percy Noel.","The Hokuseido Press,",1937.
9952175516601401,.b11639702,The Japanese and Sun Yat-sen.,"Harvard University Press,",1954.
9952175534901401,.b11635988,"Far Eastern war, 1937-1941, by Harold S. Quigley ...","World Peace Foundation,",1942.
9952175601201401,.b11651829,The ancient Na-khi Kingdom of southwest China.,"Harvard Univ. Press,",c1947 [i.e. 1948]
9952175708001401,.b11637316,"Peking diary, a year of revolution.",Schuman,[1950]
9952175711701401,.b11644618,Last chance in China.,Bobbs-Merrill Co.,[1947]
9952175722301401,.b11628534,"Yugoslavia in crisis, 1934-1941.","Columbia University Press,",1962.
9952175726801401,.b11628352,"United States policy and the partition of Turkey, 1914-1924.",Johns Hopkins Press,[1965]
9952175727101401,.b11635563,No peace for Asia.,"The Macmillan Company,",1947.
9952175813201401,.b11669986,"James Stephen and the British colonial system, 1813-1847.","University of Wisconsin Press,",1953.
9952175815201401,.b11669779,"Sea power and British North America, 1783-1820; a study in British colonial policy, by Gerald S. Graham ...",Harvard university press;,1941.
9952175932701401,.b11672419,"The Old World in the New; the significance of past and present immigration to the American people, by Edward Alsworth Ross ... illustrated with many photographs.","The Century co.,",1914.
9952175935501401,.b11672250,"America, nation or confusion.","Harper & brothers,",1928.
9952160812801401,.b10004051,The expanded voice : the art of Thomas Traherne.,"The Huntington Library,",1970.
9952160822601401,.b10030013,"History of the Byzantine Empire, 324-1453 / [by] A.A. Vasiliev.","University of Wisconsin Press,",1952.
9952161587101401,.b10059738,First generation : in the words of twentieth-century American immigrants / [compiled by] June Namias ; with an introd. by Robert Coles.,"Beacon Press,",c1978.
9952162020501401,.b10104902,The high design; English Renaissance tragedy and the natural law [by] George C. Herndl.,"University Press of Kentucky,",1970.
9952162418601401,.b10142757,"Outlines of Tudor and Stuart plays, 1497-1642, by Karl J. Holzknecht.","Barnes & Noble, Inc.",[1947]
9952162580101401,.b1017607x,Monarchy in the emperor's eyes : image and reality in the Ch'ien-lung Reign / Harold L. Kahn.,"Harvard University Press,",1971.
9952162755701401,.b10199706,The first duce : D'Annunzio at Fiume / Michael A. Ledeen.,"Johns Hopkins University Press,",c1977.
9952163379801401,.b1026338x,"Lyrics from English airs, 1596-1622.","Harvard University Press,",1970.
9952163702801401,.b10293504,Blues of the sky : interpreted from the original Hebrew Book of Psalms / David Rosenberg.,"Harper & Row,",c1976.
9952164243901401,.b10358249,A short history of China / Hilda Hookham ; with an introduction by Professor J. Mason Gentzler.,New American Library,[1972]
9952164787101401,.b10443587,"The fall of imperial China / Frederic Wakeman, Jr.","Free Press,",[1975]
9952164848501401,.b1041423x,The Sui dynasty / Arthur F. Wright.,"Knopf,",1978.
9952165584501401,.b10539463,An outline history of China : with a thorough account of the republican era interpreted in its historical perspective / by Herbert H. Gowen...and Josef Washington Hall.,"D. Appleton,",1926.
9952166708401401,.b10648574,From one China to the other. Photos. by Henri Cartier-Bresson. Text by Han Suyin [pseud.] Edited by Robert Delpire.,Universe Books,[1956]
9952167486101401,.b10766091,The tragedy of state [by] J.W. Lever.,"Methuen,",1971.
9952167486801401,.b10766029,Drama & society in the age of Jonson / [by] L. C. Knights.,"Chatto & Windus,",1962
9952167487601401,.b10765943,"Literary criticism from the Elizabethan dramatists; repertory and synthesis, by David Klein ... with an introductory note by J.E. Spingarn.","Sturgis & Walton Company,",1910.
9952167560301401,.b10753424,"The Esdaile poems: early minor poems from the Esdaile notebook; edited from the manuscripts with introd., commentary, and notes by Neville Rogers.","Clarendon Press,",1966.
9952167584201401,.b10757430,Poems of dedication.,Random,[1947]
9952167689801401,.b10763429,"The owl and the nightingale, ed. by John Edwin Wells ...","D.C. Heath and Co.,",1907.
9952167703901401,.b10765621,"The Inns of court and early English drama, by A. Wigfall Green, with aa preface by Roscoe Pound ....",Yale university press;,1931.
9952167704801401,.b10765530,Disguise plots in Elizabethan drama; a study in stage tradition ...,,"Columbia university press,"
9952167714101401,.b10767228,"English tragicomedy, its origin and history, by Frank Humphrey Ristine, PH.D.","The Columbia university press,",1910.
9952167726201401,.b10764884,Studies in the development of the fool in the Elizabethan drama.,"H. Milford, Oxford University Press,",1923.
9952167731401401,.b10765372,Elizabethan theatre.,"Edward Arnold,",1966.
9952167732201401,.b10765293,Endeavors of art: a study of form in Elizabethan drama.,"University of Wisconsin Press,",1954.
9952167734601401,.b10765049,English religious drama of the Middle Ages.,"Clarendon Press,",1955.
9952167738401401,.b10768890,"Plays & masques at court during the reigns of Elizabeth, James and Charles, by Mary Susan Steele ...",Yale University Press;,1926.
9952167851101401,.b10766649,"A history of late eighteenth century drama, 1750-1800, by Allardyce Nicoll ...","The University Press,",1927.
9952167855201401,.b10805576,Eighteenth-century plays; with introd. by Ricardo Quin      tana.,Modern Library,[1952]
9952167974101401,.b10805308,Early English classical tragedies.,"The Clarendon Press,",1912.
9952167976801401,.b10805023,"More one-act plays by modern authors, edited by Helen Louise Cohen; designs by art classes of Washington Irving High School.","Harcourt, Brace and Company",[c1927]
9952168056701401,.b10818248,"A dream of fair women, by Alfred Tennyson ...","J.R. Osgood and company,",1880.
9952168061501401,.b10819460,"A concordance to the poetical and dramatic works of Alfred, lord Tennyson including the poems contained in the ""Life of Alfred, lord Tennyson"" and the ""Suppressed poems,"" 1830-1868. By Arthur E. Baker ...","K. Paul, Trench, Trubner & co., ltd.,",1914.
9952168071201401,.b10822252,"Poems and The spring of joy, with an introduction by Walter De La Mare.","E.P. Dutton & Company, Inc.",[c1929]
9952168073301401,.b10822112,The poems of William Watson.,"J. Lane,",1905.
9952168079001401,.b10821764,The poems of Edmund Waller; ed. by G. Thorn Drury.,Routledge;,[1893]
9952168153301401,.b10841465,"Come hither; a collection of rhymes and poems for the young of all ages, made by Walter de la Mare, and embellished by Alec Buckels.",A. A. Knopf,[c1923]
9952168156601401,.b10841118,"Modern verse in English, 1900-1950. Edited by David Cecil and Allen Tate, with critical introductions on British and American poetry, and biographical notes on the poets included.",Macmillan,[1958]
9952168182701401,.b10840990,Religious lyrics of the XIVth century.,"The Clarendon press,",1924.
9952168187001401,.b10840503,"The English lyric, by Felix E. Schelling.","Houghton Mifflin Company,",1913.
9952168224501401,.b10824984,Wordsworth's anti-climax.,"Harvard university press,",1935.
9952168257301401,.b10839707,The ballad revival; studies in the influence of popular on sophisticated poetry.,University of Chicago Press,[1961]
9952168258501401,.b10839598,"The English sonnet, by T.W.H. Crosland ...",M. Secker,[1917]
9952168307501401,.b10830984,The complete works of Edmund Spenser.,T.Y. Crowell & co.,[1903]
9952168406501401,.b1084255x,"A little anthology of Canadian poets, edited by Ralph Gustafson.",New directions,[1943]
9952168406901401,.b10842512,Poets in their pride.,Basic Books,[1964]
9952168444101401,.b10840114,The secular lyric in Middle English.,University of Kentucky Press,[1951]
9952168444501401,.b10840072,"The quest of the ballad, by W. Roy Mackenzie.","Princeton university press; [etc., etc.]",1919.
9952168445601401,.b10839938,"Ballad books and ballad men; raids and rescues in Britain, America, and the Scandinavian north since 1800, by Sigurd Bernhard Hustvedt ...","Harvard University Press,",1930.
9952168621501401,.b10864684,"Modern British poetry, a critical anthology, edited by Louis Untermeyer.","Harcourt, Brace and Company",[c1936]
9952169584701401,.b11198795,China since 1911/ George Moseley.,"Harper & Row,","[1969, c1968]"
9952169600501401,.b11199222,Assignment China / by Julian Schuman.,"Whittier Books,",1956.
9952169601401401,.b11199131,The enemy within : an eyewitness account of the communist conquest of China / by Raymond J. De Jaegher and Irene Corbally Kuhn.,"Doubleday,","1953, c1952."
9952169711001401,.b11204989,"China in ferment; perspectives on the cultural revolution. Edited by Richard Baum, with Louise B. Bennett.",Prentice-Hall,[1971]
9952170536201401,.b1128612x,Responsible government in the dominions / by Arthur Berriedale Keith.,"The Clarendon press,",1912.
9952172358901401,.b11059564,"Willobie his Avisa, 1594. With an essay on Willobie his Avisa, by G. B. Harrison, M.A.",John Lane;,[1926]
9952172611101401,.b11074139,A nation of immigrants [by] John F. Kennedy.,Harper and Row,[1964]
9952172620001401,.b11069508,The tragedy of the Chinese revolution.,Stanford Univ. Press,[1951]
9952172748301401,.b11073780,"Elizabethan lyrics from the original texts / chosen, edited and arranged by Norman Ault.","Longmans, Green and Co.,",1928.
9952174616301401,.b11563230,The documentary hypothesis and the composition of the Pentateuch; eight lectures. Translated from the Hebrew by Israel Abrahams.,"Magnes Press, Hebrew University",[c1961]
9952174752001401,.b11562201,Daniel; his life and times.,Revell,[1888]
9952175217301401,.b11626562,"Balkan union; a road to peace in southeastern Europe, by Theodore I. Geshkoff.","Columbia University Press,",1940.
9952175218101401,.b11626483,"Turkey, the great powers, and the Bagdad railway; a study in imperialism, by Edward Mead Earle ...","The Macmillan Company,",1924.
9952175365901401,.b11630000,"War and diplomacy in eastern Asia, by Claude A. Buss.","The Macmillan company,",1941.
9952175370701401,.b11649811,"The other side of the river, Red China today.",Random House,[1962]
9952175462901401,.b11644187,China looks forward [by] Sun Fo; with an introduction by Lin Yutang.,John Day,[1944]
9952175472201401,.b11640935,"China fights on, an inside story of China's long struggle against our common enemies, by Pan Chao-ying, PH.D. (Stephen C. Y. Pan)",Fleming H. Revell company,[1945]
9952175481101401,.b1162694x,"The Turkish ordeal; being the further memoirs of Halide Edib, with a frontispiece in color by Alexandre Pankoff and many illustrations from photographs.",The Century Co.,[1928]
9952175492401401,.b11636749,Far eastern politics in the postwar period.,Appleton-Century-Crofts,[1956]
9952175501701401,.b11646056,Harem favorites of an illustrious celestial.,"Lin Yun-peng,",1958]
9952175546301401,.b11639544,"The Chinese revolution; a phase in the regeneration of a world power, by Arthur N. Holcombe.","Harvard university press,",1930.
9952175575001401,.b11648120,"20th century China, by O. Edmund Clubb.","Columbia University Press,",1964.
9952175575401401,.b11647577,"Li Hung-chang and the Huai Army; a study in nineteenth-century Chinese regionalism. Introd.: Regionalism in nineteenth-century China, by Franz Michael.",University of Washington Press,[1964]
9952175591801401,.b11637882,"Modern China, a political study, by Sih-Gung Cheng ...","The Clarendon press,",1919.
9952175599001401,.b11629241,"Japan unmasked, by Hallett Abend.","I. Washburn, Inc.",[c1941]
9952175611001401,.b11629150,"A history of the Roumanians; from Roman times to the completion of unity, by R. W. Seton-Watson.","The University press,",1934.
9952175616701401,.b11629113,"Contemporary Roumania and her problems; a study in modern nationalism, by Joseph S. Roucek.","H. Milford, Oxford university press,",1932.
9952175631501401,.b11651052,"The mingling of the Canadian and American peoples. Volume I, Historical, by the late Marcus Lee Hansen ... Completed and prepared for publication by John Bartlet Brebner ...",Yale University Press;,1940.
9952175635601401,.b11647760,My war with Japan.,H. Holt and Company,[1943]
9952175647801401,.b11651507,"The American-born in Canada; a statistical interpretation, by R. H. Coats and M. C. MacLean.",The Ryerson Press;,1943.
9952175651401401,.b11647139,"The Chinese and their rebellions, viewed in connection with their national philosophy, ethics, legislation, and administration. To which is added, an essay on civilization and its present state in the East and West.",Academic Reprints,[n.d.]
9952175709001401,.b11637213,China shakes the world.,Harper,[1949]
9952175709401401,.b11637195,"China; an interpretation, by James W. Bashford.",The Abingdon press,[c1919]
9952175712401401,.b11644576,"A short history of Chinese civilization, by Tsui Chi, with a preface by Laurence Binyon.",Putnam,[1943]
9952175716901401,.b11644369,"The struggle for north China, by George E. Taylor ...","International Secretariat, Institute of Pacific Relations,",1940.
9952175719101401,.b11629927,The Far East; a history of recent and contemporary international relations in east Asia.,Macmillan,[1955]
9952175723001401,.b11628510,Yugoslavia and the new communism [by] George W. Hoffman [and] Fred Warner Neal.,"Twentieth Century Fund,",1962.
9952175723701401,.b11635666,"The Asian-African Conference, Bandung, Indonesia, April 1955.",Cornell University Press,[1956]
9952175725101401,.b11628431,"My native land, by Louis Adamic ...","Harper & Brothers,",1943.
9952175727901401,.b11629575,"Old Testament history, by Ismar J. Peritz.","The Abingdom Press,","Cincinnati,"
9952175728401401,.b11635526,"New cycle in Asia; selected documents on major international developments in the Far East, 1943-1947, with notes and introd. Issued under the auspices of the International Secretariat, Institute of Pacific Relations.","Macmillan Co.,",1947.
9952175729201401,.b11628248,"Russia and the Balkans 1870-1880, by B.H. Sumner ...","The Clarendon Press,",1937.
9952175750001401,.b11627669,Phoenix ascendant; the rise of modern Turkey.,R. Hale,[1958]
9952175815601401,.b1166972x,"An essay upon the government of the English plantations on the continent of America (1701) An anonymous Virginian's proposals for liberty under the British crown, with two memoranda by William Byrd. Edited by Louis B. Wright.","Huntington Library,",1945.
9952175902901401,.b11671154,"Urbanization and migration in West Africa, edited by Hilda Kuper.","University of California Press,",1965.
9952175905401401,.b11670897,Hindu colonies in the Far East.,Firma K.L. Mukhopadhyay,[1963]
9952175907101401,.b11670770,France overseas; a study of modern imperialism.,"Octagon Books,",1966.
9952175933301401,.b11672389,Why Europe leaves home; a true account of the reasons which cause central Europeans to overrun America ... With illus. from photographs.,Bobbs-Merrill,[c1922]
9952175935701401,.b11672237,The Ellen Knauff story.,W. W. Norton,[c1952]
9952160828001401,.b10029837,Poetry and drama in the York Corpus Christi play / Richard J. Collier.,"Archon Books,","1978, c1977."
9952161548801401,.b10009115,Victorian imperialism / C. C. Eldridge.,"Humanities Press,",1978.
9952161711001401,.b10049551,Chinese immigration/ by Mary Roberts Coolidge.,"H. Holt and Company,",1909.
9952162340601401,.b10118585,Red China today.,,1970.
9952163188801401,.b10243112,"Elizabethan erotic narratives : irony and pathos in the Ovidian poetry of Shakespeare, Marlowe, and their contemporaries / William Keach.","Rutgers University Press,",c1977.
9952163962101401,.b10351644,"Next week--East Lynne : domestic drama in performance, 1820-1874 / Gilbert B. Cross.","Bucknell University Press,",c1977.
9952164903201401,.b10433831,China's imperial past : an introduction to Chinese history and culture / Charles O. Hucker.,"Stanford University Press,",1975.
9952164983501401,.b1045259x,The peasant rebellions of the late Ming dynasty.,Published for the Association for Asian Studies by the University of Arizona Press,[1970]
9952164988301401,.b10442030,Shakespeare and the Bawdy Court of Stratford [by] E. R. C. Brinkworth; illustrated by Wendy Jones.,"Phillimore,",1972.
9952165343001401,.b10481837,Taiwan's politics : the provincial assemblyman's world / Arthur J. Lerman.,"University Press of America,",c1978.
9952167474301401,.b10770136,"The court masque; a study in the relationship between poetry & the revels, by Enid Welsford.","The University press,",1927.
9952167477301401,.b10769742,"The evolution of the English drama up to Shakespeare, with a history of the first Blackfriars theatre; a survey based upon original records now for the first time collected and published, by Charles William Wallace.","G. Reimer,",1912.
9952167484501401,.b10766297,"English pastoral drama, from the Restoration to the date of the publication of the ""lyrical ballads"" (1660-1798) by Jeannette Marks.",Methuen,[1908]
9952167701901401,.b10765864,"The renascence of the English drama; essays, lectures, and fragments relating to the modern English stage, written and delivered in the years 1883-94.","Macmillan and co.,",1895.
9952167712501401,.b10767381,"The comedy of manners from Sheridan to Maugham, by Newell W. Sawyer ...",University of Pennsylvania Press;,1931.
9952167722801401,.b10769511,"The triumph of realism in Elizabethan drama, 1558-1612. By Willard Thorp.","Princeton university press,",1928.
9952167727201401,.b10764781,"English dramatic form; a history of its development, by M. C. Bradbrook.",Barnes & Noble,[1965]
9952167727401401,.b10764756,The contemporary drama of Ireland.,"Little, Brown,",1917.
9952167730201401,.b10764446,"The Elizabethan jig and related song drama, by Charles Read Baskervill.",The University of Chicago press,[1929]
9952167732901401,.b10765220,"Restoration comedy, 1660-1720, by Bonamy Dobree.","The Clarendon Press,",1924.
9952167778901401,.b10785231,"The man who was Shakespeare, by Eva Turner Clark.","R. R. Smith,",1937.
9952167849201401,.b10766868,"The comic spirit in Restoration drama; studies in the comedy of Etherege, Wycherley, Congreve, Vanbrugh, and Farquhar, by Henry Ten Eyck Perry.","Yale University Press,",1925.
9952167851901401,.b1076656x,"British drama; an historical survey from the beginnings to the present time, by Allardyce Nicoll.",Thomas Y. Crowell company,[c1925]
9952167855501401,.b10805540,Eight famous Elizabethan plays; introduction by Esther Cloudman Dunn ...,The Modern Library,[c1932]
9952167907401401,.b10787975,Shakespeare's legal acquirements considered. By John lord Campbell...in a letter to J. Payne Collier.,"D. Appleton & Co.,",1859.
9952168074701401,.b10822045,Selected poems.,New Directions,[1948]
9952168080801401,.b10818327,"Enoch Arden, &c., by Alfred Tennyson.","Ticknor and Fields,",1864.
9952168096401401,.b10807755,"Modern American and British plays, by S. Marion Tucker ...",Harper & Brothers,[c1931]
9952168102301401,.b10816525,Topics in Chinese history / by Lien-Sheng Yang.,"Harvard University Press,",1950.
9952168134801401,.b10807780,"Twelve one-act plays for study and production, by S. Marion Tucker ...",Ginn and Company,[c1929]
9952168155601401,.b10841222,"Anthology of Irish verse, ed. with an introduction by Padraic Colum.","Boni and Liveright,",1922.
9952168172901401,.b10839288,Four poets on poetry.,Johns Hopkins Press,[1959]
9952168173501401,.b10839215,"English epic and heroic poetry, by W. Macneile Dixon.","J. M. Dent & Sons, Ltd.;",1912.
9952168177901401,.b10833924,"That soueraine light; essays in honor of Edmund Spenser, 1552-1952, edited by William R. Mueller and Don Cameron Allen.","Johns Hopkins Press,",1952.
9952168185001401,.b10840710,"The poet's tongue; an anthology, chosen by W. H. Auden and John Garrett.","G. Bell & Sons Ltd.,",1935.
9952168185501401,.b10840667,"Poems of the English race, selected and ed. by Raymond Macdonald Alden.","C. Scribner's Sons,",1921.
9952168185701401,.b10840643,"English and Scottish popular ballads, selected and ed. for study under the supervision of William Allan Neilson ... by R. Adelaide Witham.",Houghton Mifflin Company,[c1909]
9952168186101401,.b1084059x,"Ballades and rondeaus, chants royal, sestinas, villanelles, &c. / selected, with chapter on the various forms by Gleeson White.","W. Scott,",1887.
9952168187301401,.b10840473,An analytical index to the ballad-entries (1557-1709) in the registers of the Company of Stationers of London. Compiled by Hyder E. Rollins. Foreword by Leslie Shepard.,"Tradition Press,",1967 [c1924]
9952168204601401,.b10825368,"A concordance to the poems of William Wordsworth, edited for the Concordance Society, by Lane Cooper ...","Smith, Elder,",1911.
9952168206801401,.b10825101,"Strange seas of thought, studies in William Wordsworth's philosophy of man and nature, by Newton P. Stallknecht.","Duke University Press,",1945.
9952168212801401,.b10821107,The mystical poetry of Thomas Traherne by A. L. Clements.,"Harvard University Press,",1969.
9952168238301401,.b10807160,Nineteenth century plays.,Oxford University Press,[1953]
9952168256401401,.b10839756,The shield of Achilles; essays on beliefs in poetry.,"Harcourt, Brace",[1944]
9952168257601401,.b10839689,"A literary history of the popular ballad, by David C. Fowler.","Duke University Press,",1968.
9952168327901401,.b10832051,Duessa as theological satire [by] D. Douglas Waters.,University of Missouri Press,[1970]
9952168341901401,.b10817657,"Swinburne, by George Edward Woodberry.","The MacMillan Co.,",1912 [c1905]
9952168408301401,.b10842366,"Victorian songs; lyrics of the affections and nature, collected and illustrated by Edmund H. Garrett, with an introduction by Edmund Gosse.","Little, Brown",1895.
9952168409001401,.b10842299,"Songs of horses, an anthology selected and arranged by Robert Frothingham.","Houghton Mifflin company,",1920.
9952168410301401,.b10842159,"Poetry now, an anthology.",Faber and Faber,[1956]
9952168425401401,.b10843966,"The Oxford book of nineteenth-century English verse, chosen by John Hayward.","Clarendon Press,",1964.
9952168453201401,.b10853728,The death bell; poems and ballads.,Faber and Faber,[1954]
9952168513501401,.b10843012,The Oxford book of twentieth-century English verse; chosen by Philip Larkin.,"Clarendon Press,",1973.
9952168515001401,.b1084286x,"The standard book of British and American verse, selected by Nella Braddy ... preface by Christopher Morley.","The Garden City publishing company, inc.",[c1932]
9952168521701401,.b10841702,"Anthology for the Enjoyment of poetry, by Max Eastman.",C. Scribner's sons;,1939.
