9952176137101401,.b11691773,"Foreign banking systems, by E.H.D. Arndt, B.H. Beckhart, H.E. Butson ... [and others] Edited by H. Parker Willis and B.H. Beckhart.",H. Holt and Company,[c1929]
9952176177101401,.b11728607,The ecological basis for subsistence change among the Sandawe of Tanzania [by] James L. Newman.,"National Academy of Sciences,",1970.
9952176187601401,.b11718419,A time to choose : America's energy future : final report / by the Energy Policy Project of the Ford Foundation.,"Ballinger Pub. Co.,",1974.
9952176204601401,.b11715728,"Farm crisis, 1919-1923.","University of California Press,",1957.
9952176223201401,.b1171296x,"Capital, saving and credit in peasant societies : studies from Asia, Oceania, the Caribbean and Middle America / essays edited with two general essays, by Raymond Firth and B.S. Yamey.","Aldine Pub. Co.,",c1964.
9952176274901401,.b11725916,"Justice and administrative law; a study of the British Constitution, by William A. Robson.",Greenwood Press,[1970]
9952176291801401,.b11728000,"Subsistence agriculture and economic development, edited by Clifton R. Wharton, Jr.",Aldine Pub. Co.,[1969]
9952176392801401,.b11752373,Producing for the Web / Jason Whittaker.,"Routledge,",2000.
9952176438701401,.b11747067,Scientific discovery processes in humans and computers : theory and research in psychology and artificial intelligence / Morton Wagman.,"Praeger,",2000.
9952176479901401,.b11731928,"An outline of the British labor movement, by Paul Blanshard, with an introduction by the Rt. Hon. Arthur Henderson.",George H. Doran company,[c1923]
9952176502001401,.b11732581,"Trade unions in Canada, their development and functioning.","Macmillan Co. of Canada,",1948.
9952176504501401,.b11732313,"Capital and labor under fascism, by Carmen Haider, Ph.D.",Columbia university press;,1930.
9952176528401401,.b11733469,"The rise of the British coal industry, by J.U. Nef.","G. Routledge,",1932.
9952176541201401,.b11715789,"The agrarian history of Western Europe, A.D. 500-1850. Translated by Olive Ordish.","St. Martin's Press,",1963 [i. e. 1964]
9952177040301401,.b11826137,"Programming languages : design and implementation / Terrence W. Pratt, Marvin V. Zelkowitz.","Prentice Hall,",c1996.
9952177215901401,.b11879701,Data analysis with Excel : an introduction for physical scientists / Les Kirkup.,"Cambridge University Press,",2002.
9952177282601401,.b11920257,"PHP and MySQL Web development / Luke Welling, Laura Thompson.","Sams,",c2003.
9952177554701401,.b11979938,Emergence : from chaos to order / John H. Holland.,"Addison-Wesley,",c1998.
9952177589301401,.b11940918,The Internet under the hood : an introduction to network technologies for information professionals / Robert E. Molyneux.,"Libraries Unlimited,",c2003.
9952178046601401,.b11996158,"Reading and understanding research / Lawrence F. Locke, Stephen J. Silverman, Waneen Wyrick Spirduso.","Sage Publications,",c2004.
9952178536101401,.b12267703,The medium is the massage / Marshall McLuhan and Quentin Fiore; co-ordinated by Jerome Agel.,Bantam Books,1967.
9952179725201401,.b1389979x,Data structures and algorithm analysis in Java / Mark Allen Weiss.,"Pearson,",c2012.
9952179744101401,.b13910437,Algorithmic problem solving / Roland Backhouse.,"Wiley,",2011.
9952180208001401,.b18943524,"Emotions, technology, and design / edited by Sharon Y. Tettegah, Safiya Umoja Noble.","Elsevier Academic Press,",2016.
9952180575801401,.b19196143,Storytelling with data : a data visualization guide for business professionals / Cole Nussbaumer Knaflic.,"Wiley,",[2015]
9952181513201401,.b17460384,Thinking in systems : a primer / Donella H. Meadows ; edited by Diana Wright.,"Chelsea Green Pub.,",c2008.
9952181546701401,.b17668979,Raspberry Pi projects for the evil genius / Donald Norris.,"McGraw Hill Education,",[2014]
9952160769401401,.b10023240,America's way out: a program for democracy.,"The Macmillan Company,",1931.
9952160808201401,.b10026411,Communism and Christ. Foreword by Horace W. B. Donegan.,"Morehouse-Gorham Co.,",1952.
9952160809801401,.b10026198,A study of bolshevism.,"Free Press,",[1953]
9952160871101401,.b10019327,"Ourselves, inc.; the story of consumer free enterprise, by Leo R. Ward.",Harper & brothers,[1945]
9952160905201401,.b10000112,Comstock mining and miners. A reprint of the 1883 edition. Appropriate illus. have been added to augment the text. With introd. by David F. Myrick.,"Howell-North,",1959.
9952161363701401,.b10034237,"War debts and world prosperity, by Harold G. Moulton and Leo Pasvolsky.",Pub. for the Brookings Institution by the Century Co.,[1932]
9952161367101401,.b10033841,"Effects of Selective employment tax; final report, by W. B. Reddaway and D. R. Glynn [and others]","University Press,",1973.
9952161463201401,.b10031194,Christianizing the social order.,"The Macmillan company,",1912.
9952161480901401,.b10038930,"The structure of monetarism / Thomas Mayer, with contributions by Martin Bronfenbrenner ... [et al.].","Norton,",c1978.
9952161492301401,.b10032447,"Readings in the economics of taxation, selected by a committee of the American Economic Association. Selection committee for this volume: Richard A. Musgrave [and] Carl S. Shoup.","Published for the association by R. D. Irwin,",1959.
9952161493101401,.b10032356,"Planning and control of public works; report of the Committee on Recent Economic Changes of the President's Conference on Unemployment; including the report of Leo Wolman of the National Bureau of Economic Research, inc.","National Bureau of Economic Research, inc.,",1930.
9952161498901401,.b10034651,"Florentine public finances in the early Renaissance, 1400-1433.","Harvard University Press,",1971.
9952161507101401,.b10028353,"Marxism, one hundred years in the life of a doctrine, by Bertram D. Wolfe.","Dial Press,",1965.
9952161515801401,.b10020548,Socialist thought: a documentary history. Edited by Albert Fried and Ronald Sanders.,Aldine Publishing,[1964]
9952161520601401,.b10024268,The coming defeat of communism.,J. Day,[1950]
9952161556301401,.b10060455,"Federal budget and fiscal policy, 1789-1958.",Brookings Institution,[1959]
9952161854601401,.b10100702,Gender and culture : kibbutz women revisited / Melford E. Spiro.,"Duke University Press,",1979.
9952162019201401,.b10109183,"The cultural roots of national socialism / Hermann Glaser ; translated, with an introd. and notes, by Ernest A. Menze.","University of Texas Press,",c1978.
9952162138001401,.b10100283,The endangered sector / Waldemar A. Nielsen.,"Columbia University Press,",1979.
9952162251001401,.b10122503,From primitives to Zen ; a thematic sourcebook of the history of religions.,"Harper & Row,",1977.
9952162619201401,.b10161910,Designing the user interface : strategies for effective human-computer interaction / Ben Shneiderman.,"Addison-Wesley,","[1993], c1992."
9952162655401401,.b10187789,The Fiscal crisis of American cities : essays on the political economy of urban America with special reference to New York / edited by Roger E. Alcaly and David Mermelstein.,"Vintage Books,","1977, c1976."
9952163172301401,.b1025089x,The national energy plan.,"U.S. Government Printing Office,",1977.
9952163173101401,.b10252149,Essays in nineteenth-century American legal history / edited by Wythe Holt.,"Greenwood Press,",1976.
9952163825001401,.b10306341,Agricultural development in China and India : a comparative study / Kalyani Bandyppadhyaya.,"Wiley,",c1976.
9952163968201401,.b10350433,"Proposals that work : a guide for planning dissertations and grant proposals / Lawrence F. Locke, Waneen Wyrick Spirduso, Stephen J. Silverman.","Sage Publications,",c1993.
9952164819101401,.b10443332,"Financial administration under the T'ang dynasty, by D. C. Twitchett.","University Press,",1970.
9952165229301401,.b10471571,"Distributed systems : concepts and design / George Coulouris, Jean Dollimore, Tim Kindberg.","Addison-Wesley,",c1994.
9952165761901401,.b10553800,"The Internet : a guide for chemists / Stephen [i.e. Steven] M. Bachrach, editor.","American Chemical Society,",1996.
9952167429901401,.b10733152,"The nature of computation : an introduction to computer science / Ira Pohl, Alan Shaw.","Computer Science Press,",c1981.
9952167621401401,.b10746663,The million dollar lawyers / by Joseph C. Goulden.,"Putnam,",c1978.
9952167706501401,.b10768002,Nonconformity in the nineteenth century; edited by David M. Thompson.,"Routledge and K. Paul,",1972.
9952168837201401,.b10880446,"God and Mammon, by Francois Mauriac.","Sheed & Ward,",1936.
9952169331301401,.b10930899,Does Jane compute? : preserving our daughters' place in the cyber revolution / Roberta Furger.,"Warner Books,",c1998.
9952169917001401,.b11240283,Chaotic dynamics : an introduction / Gregory L. Baker and Jerry P. Gollub.,"Cambridge University Press,",1990.
9952170325101401,.b11265899,An introduction to operating systems / Harvey M. Deitel.,"Addison-Wesley Pub. Co.,","1989, c1990."
9952170521501401,.b11294814,"Understanding computers and cognition : a new foundation for design / Terry Winograd, Fernando Flores.","Addison-Wesley,",c1987 (1990 printing).
9952170765101401,.b11331860,"Out of control : the new biology of machines, social systems, and the economic world / Kevin Kelly.","Addison-Wesley,",[1995]
9952171149401401,.b11363307,"An introduction to parallel programming / K. Mani Chandy, Stephen Taylor.","Jones and Bartlett,",c1992.
9952171231001401,.b11363514,"History of the Internet : a chronology, 1843 to the present / Christos J.P. Moschovitis ... [et al.].","ABC-CLIO,",c1999.
9952171239201401,.b11361475,"Handbook on parallel and distributed processing / Jacek Blazewicz ... [et al.], editors.","Springer,",c2000.
9952171704101401,.b10978811,Object-oriented programming : an evolutionary approach / Brad J. Cox.,"Addison-Wesley,",c1986.
9952172600901401,.b11074516,The two cultures and the scientific revolution.,Cambridge University Press,[1959]
9952172687601401,.b11094138,Marx's Paris writings: an analysis [by] John Maguire. With an introd. by David McLellan.,Gill and Macmillan,[1972]
9952172842701401,.b11088321,Programming with constraints : an introduction / Kim Marriott and Peter J. Stuckey.,"MIT Press,",c1998.
9952173087201401,.b11137976,Iberian fathers. Translated by Claude W. Barlow.,Catholic University of America Press,[1969-
9952174593101401,.b11572413,The token-ring management guide / Martin A.W. Nemzow.,"McGraw-Hill,",c1993.
9952174699101401,.b11580409,"Themis, a study of the social origins of Greek religion. With an excursus on the ritual forms preserved in Greek tragedy by Gilbert Murray and a chapter on the origin of the Olympic games by F. M. Cornford.",World Pub. Co.,"[1962, c1927]"
9952174787201401,.b11583344,That old-time religion.,"Houghton Mifflin,",1950.
9952174979001401,.b11620341,"The social sources of denominationalism, by H. Richard Niebuhr.",H. Holt and Company,[c1929]
9952175084801401,.b11623858,"The Muslim community of the Indo-Pakistan subcontinent, 610-1947; a brief historical analysis.","Mouton,",1962.
9952175125401401,.b1161917x,"Hebrew religion, its origin and development, by W.O.E.  Oesterley and Theodore H. Robinson.",The Macmillan co.,[1930]
9952175493201401,.b11639799,Confucian personalities. Edited by Arthur F. Wright and Denis Twitchett. With contributions by Albert E. Dien [and others],"Stanford University Press,",1962.
9952175606601401,.b11654041,"The Bible of mankind, compiled and edited by Mirza Ahmad Sohrab.","Universal Publishing Co.,",1939.
9952175665601401,.b11654302,"The world's great scriptures; an anthology of the sacred books of the ten principal religions, compiled and annotated with historical introductions and interpretive comments by Lewis Browne. With decorations and maps by the editor.","The Macmillan company,",1946.
9952175698001401,.b11645118,Kingdom of the saints; the story of Brigham Young and the Mormons.,"Viking Press,",1957.
9952175752801401,.b11644242,"Piety versus moralism; the passing of the New England theology, by Joseph Haroutunian.",H. Holt,[c1932]
9952175881401401,.b11678562,Principles of political economy; with some of their applications to social philosophy. By John Stuart Mill; with a special introduction by Arthur T. Hadley.,Colonial Press,[1899]
9952175980001401,.b11698469,Conserving natural resources; principles and practice in a democracy.,"McGraw-Hill,",1955.
9952175992201401,.b11693770,"A treatise on money, by John Maynard Keynes ...","Harcourt, Brace and Company",[1930]
9952175993001401,.b11696990,Capital markets and institutions.,Prentice-Hall,[1965]
9952176007801401,.b11692716,International economics [by] Peter B. Kenen.,Prentice-Hall,[1967]
9952176008001401,.b11692698,"The International Monetary Fund, 1945-1965; twenty years of international monetary cooperation, [edited] by J. Keith Horsefield.","International Monetary Fund,",1969.
9952176096701401,.b11698986,Conservation of natural resources.,"Wiley,",1950.
9952176102401401,.b11699760,"The ejido; Mexico's way out, by Eyler N. Simpson; with a foreword by Lic. Ramon Beteta ...","The University of North Carolina press,",1937.
9952176106501401,.b11699541,Land reform in Japan / by R.P. Dore.,"Oxford University Press,",1959.
9952176123401401,.b1169077x,"Financing American industry, and other addresses [by] E.H.H. Simmons ...",,1930]
9952176125801401,.b11691402,"Banking reform, ed. by J. Laurence Laughlin...","The National citizen's league,",1912.
9952176126701401,.b11691311,"The House of Baring in American trade and finance; English merchant bankers at work, 1763-1861.","Harvard Univ. Press,",1949.
9952176130601401,.b11692169,"Credit policies of the federal reserve system, by Charles O. Hardy.","The Brookings Institution,",1932.
9952176170901401,.b1172903x,"The United States oil policy, by John Ise.",Yale university press;,1926.
9952176187301401,.b11718456,Gezira; a story of development in the Sudan.,Faber and Faber,[1959]
9952176188201401,.b11718353,Exploring energy choices; a preliminary report.,,1974]
9952176218201401,.b11713276,"The farmer's age : agriculture, 1815-1860 / by Paul W. Gates.","Holt, Rinehart and Winston,",c1960.
9952176219801401,.b11713161,"Empire in pine : the story of lumbering in Wisconsin, 1830-1900 / by Robert F. Fries.","State Historical Society of Wisconsin,",1951.
9952176224501401,.b11712879,United States international timber trade in the Pacific area.,Stanford Univ. Press;,[1949]
9952176251901401,.b11702655,"Child labor in city streets, by Edward N. Clopper ...","The Macmillan Company,",1912.
9952176290701401,.b11728097,World agriculture; an international survey; a report by a study group of members of the Royal institute of international affairs.,"Oxford university press,",1932.
9952176291501401,.b11728036,"Middle America, by Charles Morrow Wilson.","W.W. Norton & Company, inc.",[1944]
9952176303001401,.b1171010x,Development planning; the essentials of economic policy [by] W. Arthur Lewis.,Harper & Row,[1966]
9952176315901401,.b11713896,The Lysenko affair.,"Harvard University Press,",1970.
9952176341701401,.b1171153x,Industrialization in two systems; essays in honor of Alexander Gerschenkron by a group of his students.,Wiley,[1966]
9952176396001401,.b1175137x,About face : the essentials of user interface design / Alan Cooper.,IDG Books Worldwide ;,1995.
9952176400701401,.b11717695,"Fifty million acres: conflicts over Kansas land policy, 1854-1890.",Cornell University Press,[1954]
9952176473501401,.b11726878,Contemporary problems of public law in Canada: essays in honour of Dean F. C. Cronkite. Edited by O. E. Lang.,"Published for the College of Law, University of Saskatchewan by University of Toronto Press",[c1968]
9952176474301401,.b11726763,A concise history of the common law / by Theodore F.T. Plucknett.,"Little, Brown,",1956.
9952176484101401,.b11731758,History of labour in the United States / by John R. Commons ... [et al.] ; with an introductory note by Henry W. Farman.,"Macmillan,",1918-1935.
9952176485001401,.b11731692,"The new unionism in the clothing industry, by J. M. Budish and George Soule.","Harcourt, Brace and Howe,",1920.
9952176503501401,.b11732428,"Trade unionism in the United States, by Robert Franklin Hoxie...with an introduction by E. H. Downey...and a supplement by Mollie Ray Carroll...","D. Appleton and Company,",1923.
9952176529501401,.b11733408,"Petroleum productive capacity; a report on present and future supplies of oil and gas, presented on January 29, 1952.",,1952]
9952176530901401,.b11733305,Collective negotiations for teachers; an approach to school administration [by] Myron Lieberman [and] Michael H. Moskow.,Rand McNally,[1966]
9952176638701401,.b1175090x,The universal computer : the road from Leibniz to Turing / Martin Davis.,"Norton,",c2000.
9952177193401401,.b11895214,"Developing IP-based services : solutions for service providers and vendors / Monique Morrow, Kateel Vijayananda.","Morgan Kaufmann Publishers,",c2003.
9952177358501401,.b11959642,Atlantis destroyed / Rodney Castleden.,"Routledge,",2001.
9952177479101401,.b11971885,"Debates on evaluation / [edited] by Marvin C. Alkin ; with contributions by Michael Quinn Patton, Carol H. Weiss ; with additional participation by Ross Conner ... [et al.].","Sage Publications,",c1990.
9952177552501401,.b11925590,"Fields of knowledge : French academic culture in comparative perspective, 1890-1920 / Fritz Ringer.","Cambridge University Press,",1992.
9952179134601401,.b13132805,"Core servlets and JavaServer pages / Marty Hall, Larry Brown.","Prentice Hall PTR,",c2004-c2008.
9952180164701401,.b18272812,Between humanities and the digital / edited by Patrik Svensson and David Theo Goldberg.,"The MIT Press,",[2015]
9952181402901401,.b17456988,Schrödinger's killer app : race to build the world's first quantum computer / Jonathan P. Dowling.,"CRC Press Taylor & Francis Group,",[2013]
9952181434501401,.b17453112,"Single page web applications : JavaScript end-to-end / Michael S. Mikowski, Josh C. Powell.","Manning,",[2013]
9952160769101401,.b10023276,Philosophical foundations of English socialism.,"Harvard University Press,",1951.
9952160778901401,.b10029308,"Fascism in Western Europe, 1900-45 [by] H. R. Kedward.","New York University Press,",1971.
9952160857701401,.b10020123,New Fabian essays [by] R. H. S. Crossman [and others]  Edited by R. H. S. Crossman. Pref. by C. R. Attlee.,"Turnstile Press,",1952.
9952160873801401,.b10019145,Labor enterprise in Palestine; a handbook of Histadrut economic institutions. Foreword by Robert R. Nathan.,"Sharon Books,",1947.
9952160902501401,.b10028560,"Vietnamese communism, its origins and development / Robert F. Turner.","Hoover Institution Press, Stanford University,",[1975]
9952161362701401,.b10034377,"Combined annual reports of the World war foreign debt commission with additional information regarding foreign debts due the United States. Fiscal years 1922, 1923, 1924, 1925 and 1926.","Govt. print. off.,",1927.
9952161375001401,.b10031649,"The communistic societies of the United States; from personal visit and obervation: including detailed accounts of the Economists, Zoarites, Shakers, the Amana, Oneida, Bethel, Aurora, Icarian and other existing societies; their religious creeds, social practices, numbers, industries, and present condition. By Charles Nordhoff.","Harper & brothers,",1875.
9952161499201401,.b10034626,"The assignats, by S.E. Harris ...","Harvard University Press,",1930.
9952161500701401,.b10034432,"Capital & finance in the age of the renaissance; a study of the Fuggers and their connections, by Richard Ehrenberg, translated from the German by H. M. Lucas.",Harcourt,[1928]
9952161525301401,.b1002380x,Marxist esthetics. Translated from the French by Helen R. Lane. With an introd. by Fredric Jameson.,Cornell University Press,[1973]
9952161554701401,.b10060625,"Monitoring revenue sharing / Richard P. Nathan, Allen D. Manvel, Susannah E. Calkins, and associates.","Brookings Institution,",[1975]
9952161584401401,.b10060042,From the Morgenthau diaries.,"Houghton Mifflin,",1959-67.
9952161599401401,.b10052446,The financial effects of inflation / Phillip Cagan and Robert E. Lipsey.,"Published for the National Bureau of Economic Research by Ballinger Pub. Co.,",1978.
9952161888101401,.b10093163,Careers in conservation : opportunities in natural resource management / edited for the Natural Resources Council of America by Henry Clepper.,"Wiley,",c1979.
9952162029001401,.b10104598,The sexes throughout nature / by Antoinette Brown Blackwell.,"Hyperion Press,",1976.
9952162315901401,.b10131693,"Computer organization and design : the hardware/software interface / John L. Hennessy, David A. Patterson.","Morgan Kaufmann,",c1994.
9952162456601401,.b1017428x,What is Islam? / W. Montgomery Watt.,"Longman,",1979.
9952162587301401,.b10184272,"Collective bargaining and manpower utilization in big city governments / David Lewin, Raymond D. Horton and James W. Kuhn ; foreword by Eli Ginzberg.","Allanheld, Csmun,",1979.
9952163825101401,.b1030633x,"La nature et les prodiges : l'insolite au 16e siecle, en France / Jean Ceard.","Droz,",1977.
9952163833201401,.b10302037,Myth / [by] K. K. Ruthven.,"Methuen,",1976.
9952164011901401,.b10342448,200 years of American business / Thomas C. Cochran.,"Basic Books,",c1977.
9952164640001401,.b1039932x,History of the African Methodist Episcopal Church.,"Arno Press,",1969.
9952165908201401,.b10568414,Introduction to computers and data processing / Gary B. Shelly & Thomas J. Cashman.,"Anaheim Pub. Co.,",c1980.
9952166417101401,.b10613158,Object solutions : managing the object-oriented project / Grady Booch.,"Addison-Wesley Pub. Co.,",c1996.
9952167388701401,.b10735525,UNIX time-sharing system : UNIX programmer's manual / Bell Telephone Laboratories.,"Holt, Rinehart and Winston,",c1983.
9952167444201401,.b10733073,The human use of human beings : cybernetics and society / Norbert Wiener.,"Da Capo Press,","1988, c1954."
9952167497201401,.b10755913,The Directory of possibilities / edited by Colin Wilson and John Grant.,Rutledge Press :,1981.
9952167777301401,.b10784317,HAL's legacy : 2001's computer as dream and reality / edited by David G. Stork.,"MIT Press,",c1997.
9952167858701401,.b10794906,"The pilgrimage to Parnassus with the two parts of The return from Parnassus. Three comedies performed in St. John's college, Cambridge, A. D. MDXCVII-MCDI.  Ed. from MSS. by the Rev. W. D. Macray.","Clarendon press,",1886.
9952168541201401,.b10849713,The works of George Chapman ...,"Chatto and Windus,",1874-75.
9952168893801401,.b10886102,"The rise and decline of the Medici Bank, 1397-1494.","Harvard University Press,",1963.
9952169965101401,.b11246674,Now what? : how to get your computer up and keep it running / Michael Schuyler.,"Neal-Schuman,",c1988.
9952170402401401,.b11287986,Architects of the information society : 35 years of the Laboratory for Computer Science at MIT / Simson L. Garfinkel ; edited by Hal Abelson ; with a foreword by Michael L. Dertouzos.,"MIT Press,",1999.
9952170444301401,.b11278109,Programming for the world : a guide to internationalization / Sandra Martin O'Donnell.,"PTR Prentice Hall,",c1994.
9952170506601401,.b11291849,"Proposed roads to freedom : socialism, anarchism and syndicalism / by Bertrand Russell.","H. Holt,",1919.
9952170917701401,.b11343151,Trade unionism and labor problems : 2d series / edited with an introduction by John R.Commons ...,Ginn and company,[c1921]
9952171132001401,.b11358440,Computer organization : a top-down approach / Greg W. Scragg.,"McGraw-Hill,",c1992.
9952171217201401,.b11358257,Algorithmics : the spirit of computing / David Harel.,"Addison-Wesley,",c1987 (1991 printing).
9952171828201401,.b10985803,The cult of information : the folklore of computers and the true art of thinking / Theodore Roszak.,"Pantheon,",1986.
9952172373401401,.b11057580,An American crusade for wildlife / by James B. Trefethen ; drawings by Peter Corbin.,"Winchester Press,",[1975]
9952173170801401,.b1114337x,La barbarie a visage humain / Bernard-Henri Levy.,"B. Grasset,",c1977.
9952173193601401,.b11135992,Theological and dogmatic works. Translated by Roy J. Deferrari.,"Catholic University of America Press,",1963.
9952173194501401,.b11135906,Dialogues / translated by Odo John Zimmerman.,"Fathers of the Church,",1959.
9952173287901401,.b11150373,The Wisdom of the early Buddhists / compiled by Geoffrey Parrinder.,"Directions Pub. Corp.,",1977.
9952173358501401,.b11415344,"The programming language landscape / Henry Ledgard, Michael Marcotty.","Science Research Associates,",c1981.
9952173389201401,.b11413736,The Turing omnibus : 61 excursions in computer science / A.K. Dewdney.,"Computer Science Press,",c1989.
9952173618801401,.b11419866,The mind tool : computers and their impact on society / Neill Graham.,"West Pub. Co.,",c1983.
9952174176201401,.b11516835,Fundamentals of structured COBOL programming / Carl Feingold.,"W. C. Brown Co.,",c1978.
9952174218601401,.b11499898,"Study guide to accompany The mind tool, computers and their impact on society, 2nd edition /prepared by James W. Boyd.","West Pub. Co.,",c1980.
9952174310501401,.b11514127,Fundamentals of COBOL programming : a structured approach / Terry M. Walker.,"Allyn and Bacon,",c1976.
9952174560501401,.b11569761,Help! : the art of computer technical support / by Ralph Wilson ; illustrated by Mari Stein.,"Peachpit Press,",c1991.
9952174840201401,.b11572838,Design and validation of computer protocols / Gerard J. Holzmann.,"Prentice Hall,",c1991.
9952174965601401,.b11619612,"The Jewish contribution to civilization, by Cecil Roth.","Harper & Brothers,",1940.
