9952174978301401,.b11620389,Church cooperation in the United States; the nation-wide backgrounds and ecumenical significance of state and local councils of churches in their historical perspective.,"The Association of Council Secretaries,",1960.
9952175032101401,.b11611571,"Anti-Semitism and emotional disorder, a psychoanalytic interpretation by Nathan W. Ackerman and Marie Jahoda.",Harper,[1950]
9952175035801401,.b11608377,The supreme doctrine: psychological studies in Zen thought. Foreword by Aldous Huxley.,"Pantheon Books,",[1955]
9952175105801401,.b11613282,"Early American Jews, by Lee M. Friedman.","Harvard University Press,",1934.
9952175368301401,.b11643286,"Mitre and sceptre; transatlantic faiths, ideas, personalities, and politics, 1689-1775.","Oxford University Press,",1962.
9952175475601401,.b1163988x,"History of Japanese religion, with special reference to the social and moral life of the nation. by Masaharu Anesaki ... With 43 illustrations ...","K. Paul, Trench, Trubner & Co., ltd.,",1930.
9952175719601401,.b11628625,The Christian of the future. [Translated by W. J. O'Hara.,Herder and Herder,[1967]
9952175745101401,.b11628200,"The papacy and world affairs as reflected in the secularization of politics, by Carl Conrad Eckhardt ...",The University of Chicago press,[1937]
9952175992801401,.b11693757,Monetary reform / by John Maynard Keynes.,"Harcourt, Brace and Co.,",1924.
9952175997701401,.b11693551,A theoretical framework for monetary analysis.,"National Bureau of Economic Research; distributed by Columbia University Press,",1971.
9952176006101401,.b11692881,The International Development Association; a new approach to foreign aid [by] James H. Weaver.,Praeger,[1965]
9952176007201401,.b11692777,"The international monetary system; problems and proposals, edited by Lawrence H. Officer and Thomas D. Willett.",Prentice-Hall,[1969]
9952176074201401,.b11694324,"Taming the tiger : an essay in the economic theory and political economy of indexation to mitigate the consequences of, and slow down, inflation / Richard Jackman, Kurt Klappholz.","Institute of Economic Affairs,",1975.
9952176098101401,.b11695481,"The Chinese inflation, 1937-1949.","Columbia University Press,",1963.
9952176118601401,.b11691104,"Chapters on the theory and history of banking, by Charles F. Dunbar ...","G.P. Putnam's Sons,",1901.
9952176120401401,.b11690951,"Banking in the early stages of industrialization; a study in comparative economic history, by Rondo Cameron with the collaboration of Olga Crisp, Hugh T. Patrick [and] Richard Tilly.","Oxford University Press,",1967.
9952176122101401,.b11690860,A financial history of the new Japan [by] T. F. M. Adams [and] Iwao Hoshii.,Kodansha International,[1972]
9952176123601401,.b11691517,"Proudhon's Solution of the social problem [by] P. J. Proudhon; including commentary and exposition by Charles A. Dana and William B. Greene, edited, with introduction, by Henry Cohen.","Vanguard press,",[1927]
9952176132101401,.b11690367,The ways and means of payment.,"A. M. Kelley,",1965.
9952176190701401,.b11718080,"Farm tenancy in the United States. An analysis of the results of the 1920 census relative to farms classified by tenure supplemented by pertinent data from other sources, by E.A. Goldenweiser and Leon E. Truesdell ...","Govt. Print. Off.,",1924.
9952176199701401,.b11714177,"Sugar economics, statistics, and documents, by Myer Lynsky, Research division. A publication of the United States Cane Sugar Refiners' Association.",,1938.
9952176206201401,.b11715686,"The farmer's last frontier, agriculture, 1860-1897, by Fred A. Shannon ...","Farrar & Rinehart, inc.",[1945]
9952176212101401,.b11715480,Food for the world.,University of Chicago Press,[1945]
9952176274301401,.b11725977,"Men and measures in the law; five lectures delivered at the Univ. of Michigan, Apr. 1948; with an introd. by E. Blythe Stason.","A.A. Knopf,",1949.
9952176335601401,.b11711048,"The Challenge of development, theory and practice; a sourcebook, edited by Richard J. Ward.",Aldine Pub. Co.,[1967]
9952176342401401,.b11711437,"Patents, invention, and economic change; data and selected essays. Edited by Zvi Griliches and Leonid Hurwicz.","Harvard University Press,",1972.
9952176457401401,.b11718663,Project Independence report.,"Federal Energy Administration : for sale by the Supt. of Docs., U.S. Govt. Print. Off.,",1974.
9952176458401401,.b11718560,"Resources and the American dream, including a theory of the limit of growth.",Ronald Press Co.,[1953]
9952176477001401,.b11732027,"Trade unionism and munitions, by G.D.H. Cole.",Clarendon Press;,1923.
9952176477501401,.b11732003,"Organized labor in Mexico, by Marjorie Ruth Clark.","The University of North Carolina Press,",1934.
9952176481001401,.b11731850,Labor in the League system : a study of the International Labor Organization in relation to international administration / Francis Graham Wilson.,"Stanford University Press,",1934.
9952176513701401,.b11732969,Union policies and industrial management [by] Sumner H. Slichter.,"The Brookings institution,",1941.
9952176516401401,.b11732647,The political role of labor in developing countries.,Brookings Institution,[1963]
9952176529001401,.b11733421,1877: year of violence.,Bobbs-Merrill,[1959]
9952176537001401,.b11716009,The new revolution in the cotton economy; mechanization and its consequences.,University of North Carolina Press,[1957]
9952176636401401,.b11753122,Introduction to algorithms / Thomas H. Cormen ... [et al.].,"MIT Press,",c2001.
9952176674401401,.b11812758,Usability engineering / Jakob Nielsen.,"Morgan Kaufmann Publishers,",c1993.
9952177040601401,.b11826125,"Programming languages : structures and models / Herbert L. Dershem, Michael J. Jipping.","PWS Pub. Co.,",c1995.
9952177149301401,.b11865040,"Beyond chaos : the underlying theory behind life, the universe, and everything / Mark Ward.","Thomas Dunne Books,",2002.
9952177937001401,.b11980254,"Turtles, termites, and traffic jams : explorations in massively parallel microworlds / Mitchel Resnick.","MIT Press,",c1994.
9952178316001401,.b1208038x,Information seeking in electronic environments / Gary Marchionini.,"Cambridge University Press,",1997.
9952178426201401,.b12078803,"Descriptive and inferential statistics : an introduction / Herman J. Loether, Donald G. McTavish.","Allyn and Bacon,",c1993.
9952179671601401,.b13901795,"Technologies for enhancing pedagogy, engagement, and empowerment in education : creating learning-friendly environments / [edited by] Thao Lê, Quynh Lê.","Information Science Reference,",c2012.
9952179815401401,.b13892630,Choosing and using statistics : a biologist's guide / by Calvin Dytham.,"Wiley-Blackwell,",2011.
9952181197001401,.b15389042,Learning the virtual life : public pedagogy in a digital world / [edited by] Peter Pericles Trifonas.,"Routledge,",2012.
9952181547901401,.b17663313,Raspberry Pi hacks : tips & tools for making things with the inexpensive Linux computer / Ruth Suehle and Tom Calloway,"O'Reilly Media,",2013.
9952181741201401,.b17772060,Interdisciplinary conversations : challenging habits of thought / Myra H. Strober.,"Stanford University Press,",2010.
9952160770801401,.b10023069,Socialism.,"McGraw-Hill Book Co.,",1949.
9952160798001401,.b1002279x,"The psychology of Bolshevism, by John Spargo.",Harper,[1919]
9952160799001401,.b10022673,"I, governor of California, and how I ended poverty: a true story of the future/ by Upton Sinclair.","U. Sinclair,",[1933]
9952160809301401,.b10026289,"Food and population : the world in crisis / George McGovern, advisory editor.","New York Times,",1975.
9952160849901401,.b10024438,"The Communist International, 1919-1943.","Oxford University Press,",1956-65.
9952160854701401,.b10027063,"Energy and environment / Stuart Bruchey, advisory editor, Gene Brown, editor.","Arno Press,",1978.
9952160875301401,.b10025571,"The theory and practice of communism, an introduction.",Bles,[1950]
9952161370101401,.b10031893,"Readings in fiscal policy, selected by a committee of the American Economic Association. [Selection committee: Arthur Smithies and J. Keith Butters]","Published for the association by R. D. Irwin,",1955.
9952161378401401,.b10031492,"The Harmonists, a personal history,... by John S. Duss.","Pennsylvania Book Service,",1943.
9952161495201401,.b10032095,Public economics. [Translated from the Norwegian by M.C. Brown and R.I. Christophursen],North-Holland Pub. Co.;,1965.
9952161497901401,.b10034754,"American participation in the China consortiums, by Frederick V. Field ...","Pub. for the American Council, Institute of Pacific Relations by the University of Chicago Press",[1931]
9952161528801401,.b10002741,Technological change: the United States and Britain in the nineteenth century; edited with an introduction by S. B. Saul.,"Methuen,",1970.
9952161531301401,.b10002467,Baking in America.,"Northwestern University Press,",1956.
9952161553201401,.b10060856,Confederate finance.,University of Georgia Press,[1954]
9952161553901401,.b1006073x,"Control of federal expenditures; a documentary history, 1775-1894, compiled by Fred Wilbur Powell.","The Brookings Institution,",1939.
9952161555901401,.b10060492,Financing State and local governments [by] James A. Maxwell.,Brookings Institution,[1965]
9952161578801401,.b10061988,"The tariff history of the United States, by F.W. Taussig ...","G. P. Putnam's sons,",1914
9952161584601401,.b10060017,Shufeldt claim. Claim of the United States of America on behalf of P. W. shufeldt v. the republic of Guatemala.,"U. S. govt. print. off.,",1932.
9952161841001401,.b10061198,Trade liberalization among industrial countries; objectives and alternatives [by] Bela Belassa.,Published for the Council on Foreign Relations by McGraw-Hill,[1967]
9952161841701401,.b10061162,"Rebuilding trade by tariff bargaining, by George P. Auld.","The National Foreign Trade Council, Inc., and the National Foreign Trade Association",[c1936]
9952161883201401,.b10085191,New profits from the monetary crisis / Harry Browne.,"Morrow,",1978.
9952162448601401,.b1014092x,Distributed systems / edited by Sape Mullender.,ACM Press ;,c1993.
9952162468901401,.b10169143,Kids & computers : a parent's handbook / Judy Salpeter with Dan Derrick ... [et al.].,"SAMS,",c1992.
9952162785101401,.b10207119,"The medicine man; a sociological study of the character and evolution of shamanism, by John Lee Maddox ... with a foreword by Professor A. G. Keller.","The Macmillan company,",1923.
9952163411001401,.b10273207,"Programming in Prolog / W.F. Clocksin, C.S. Mellish.","Springer-Verlag,",1994.
9952163449701401,.b10272355,"Inside Wall Street, 1920-1942, by S. Marshall Kempner.",,[1973]
9952164308101401,.b10372234,How numbers lie : a consumer's guide to numerical hocus pocus / by Richard P. Runyon ; illustrated by Frank Corbie.,"Lewis Pub. Co.,",c1981.
9952164476601401,.b10401040,Principles of bibliographical description.,"Russell & Russell,",1962 [c1949]
9952164490901401,.b10400515,"Major U.S. statistical series : definitions, publications, limitations / Jean Slemmons Stratford, Juri Stratford.","American Library Association,",1992.
9952164936001401,.b10427363,"Two Elizabethan Puritan diaries, by Richard Rogers and Samuel Ward. Edited, with an introd. by M.M. Knappen.","P. Smith, 1966.",
9952166305701401,.b10602239,"Capitalism and the State in U.S.-Latin American relations / edited by Richard R. Fagen ; contributors, Cynthia Arnson ... [et al.].","Stanford University Press,",1979.
9952166515201401,.b10621404,An introduction to distributed algorithms / Valmir C. Barbosa.,"MIT Press,",c1996.
9952168199701401,.b10828771,Network architectures for distributed computing = Arkhitektura vychislitelnykh setei / Eduard A. Yakubaitis ; translated by Martin Morell.,"Allerton Press,",c1983.
9952168692701401,.b1087303x,"Essai sur Mallarme. Bibliographie, portraits, fac-similes.",P. Seghers,[1963]
9952169048601401,.b1090556x,"LISP, lore, and logic : an algebraic view of LISP programming, foundations, and applications / W. Richard Stark.","Springer-Verlag,",c1990.
9952169740001401,.b11206172,Design wise : a guide to evaluating the interface design of information resources / by Alison J. Head.,"CyberAge Books,",c1999.
9952169825601401,.b11226456,"Stolen women : reclaiming our sexuality, taking back our lives / Gail Elizabeth Wyatt.","J. Wiley,",c1997.
9952170102001401,.b11257465,The Design and implementation of the 4.3BSD UNIX operating system / by Samuel J. Leffler ... [et al.].,"Addison-Wesley,",c1989.
9952170378301401,.b11293275,Introduction to the theory of programming languages / Bertrand Meyer.,"Prentice Hall,",1991.
9952170639001401,.b1129999x,"A practical guide to usability testing / Joseph S. Dumas, Janice C. Redish.","Intellect,",c1999.
9952171234701401,.b11361773,Computers as theatre / Brenda Laurel.,"Addison-Wesley Pub. Co.,",c1993.
9952171618501401,.b10966845,Classica Americana : the Greek and Roman heritage in the United States / Meyer Reinhold.,"Wayne State University Press,",1984.
9952172988501401,.b11114277,The Art of human-computer interface design / edited by Brenda Laurel.,"Addison-Wesley Pub. Co.,",c1990.
9952173177901401,.b11137654,Letters / translated by Edmund Hunt.,"Fathers of the Church,",1957.
9952173383801401,.b1141540x,Object-oriented programming in COMMON LISP : a programmer's guide to CLOS / Sonya E. Keene ; contributions by Dan Gerson ; foreword by David A. Moon.,"Addison-Wesley,",c1989.
9952173576701401,.b11453096,Scholarly arguments : strategies for writing persuasive proposals in the humanities / by Christina M. Gillis.,"Townsend Center for the Humanities, University fo California, Berkeley,",c1993.
9952173619401401,.b11419830,Theory of computation / Derick Wood.,"Harper & Row,",c1987.
9952174065701401,.b11507020,"An introduction to microcomputers, volume 1, basic concepts / by Adam Osborne.","Adam Osborne and Associates, Inc.,",c1976.
9952174066701401,.b11506921,The UNIX system V : programmer's guide / AT&T.,"Prentice-Hall,",c1987.
9952174305801401,.b11517542,The asbestos strike / edited by Pierre Elliott Trudeau ; translated by James Boake.,"James Lewis & Samuel,",1974.
9952174317601401,.b11510341,The Communist Party in Canada : a history / Ivan Avakumovic.,"McClelland and Stewart,",c1975.
9952174345701401,.b11513482,Computers and applications : an introduction to data processing / Daniel L. Slotnick ... [et al.].,"D.C. Heath,",c1986.
9952174591801401,.b11572607,"Distributed computing and the mainframe : leveraging your investments / Kurt Ziegler, Jr.","Wiley,",c1991.
9952174783701401,.b11582662,"American faith; its religious, political, and economic foundations [by] Ernest Sutherland Bates.","W.W. Norton & Company, inc.",[c1940]
9952174962501401,.b11619946,"Orthodoxy in Massachusetts, 1630-1650; a genetic study, by Perry Miller.","Harvard University Press,",1933.
9952174968101401,.b11618280,Jews in America by the editors of Fortune.,"Random House,",1936.
9952175093201401,.b11621631,Aspects of rabbinic theology. [Introd. to new edition by Louis Finkelstein],Schocken Books,[1961]
9952175499301401,.b11643997,"Pioneer church beginnings and educational movements in California, comment on a California church history, by William Warren Ferrier.",,1927.
9952175507301401,.b11652895,"War, communism, and world religions.",Harper,[1953]
9952175713501401,.b11644515,"The Baptist Church in the lower Mississippi Valley, 1776-1845.",University of Kentucky Press,[c1957]
9952175739401401,.b11645477,Christian Science: its encounter with American culture.,Holt,[1958]
9952175878801401,.b11678872,Economics: an awkward corner.,"Allen & Unwin,",1966.
9952175971401401,.b11698937,Perspectives on conservation: essays on America's natural resources/ by John Kenneth Galbraith ... [et al.]; edited by Henry Jarrett.,"Published for Resources for the Future by the Johns Hopkins Press,",[1958]
9952176074401401,.b11694300,"Do trade unions cause inflation? Two studies: with a theoretical introduction and policy conclusion [by] Dudley Jackson, H. A. Turner [and] Frank Wilkinson.","University Press,",1972.
9952176079701401,.b1169757x,"Poverty and capital development in India; contemporary investment patterns, problems and planning. Issued under the auspices of the Royal Institute of International Affairs.","Oxford University Press,",1958.
9952176096301401,.b11695560,"The optimum quantity of money, and other essays.",Aldine Pub. Co.,[1969]
9952176099301401,.b11695419,"International monetary co-operation, 1945-52.",Hutchinson's University Library,[1952]
9952176104301401,.b11695171,"A search for solvency : Bretton Woods and the international monetary system, 1941-1971 / Alfred E. Eckes, Jr.","University of Texas Press,",[1975]
9952176126201401,.b11691360,"The growth of Chicago banks, by F. Cyril James ...","Harper & Brothers,",1938.
9952176126901401,.b11691293,National and state banks : a study of their origins / by Leonard C. Helderman.,"Houghton Mifflin,",1931.
9952176128201401,.b11690586,"Personal finance, by John A. Leavitt and Carl O. Hanson.","McGraw-Hill,",1950.
9952176218601401,.b11710627,"Industrialization without national patents: the Netherlands, 1869-1912; Switzerland, 1850-1907.","Princeton University Press,",1971.
9952176221101401,.b11713082,"The European peasantry, the final phase [by] S. H. Franklin.","Methuen,",1969.
9952176224401401,.b1171024x,Leading issues in development economics; selected materials and commentary.,"Oxford University Press,",1964.
9952176273801401,.b11726027,"Bench and bar; a complete digest of the wit, humor, asperities, and amenities of the law. By L.J. Bigelow ...","Harper & Brothers,",1867.
9952176287201401,.b11728322,The national policy and the wheat economy.,"University of Toronto Press,",1957.
9952176288901401,.b11728218,Collective farming in Russia; a political study of the Soviet kolkhozy.,,1958.
9952176290401401,.b11728115,"Africans on the land; economic problems of African agricultural development in Southern, Central, and East Africa, with special reference to Southern Rhodesia.","Harvard University Press,",1964.
9952176354001401,.b1179799x,Bringing design to software / edited by Terry Winograd ... [et al.].,ACM Press ;,c1996.
9952176398901401,.b11717877,Government risk-sharing in foreign investment.,"Princeton University Press,",1965.
9952176399201401,.b11717841,Investments; analysis and management [by] Douglas A. Hayes.,Macmillan,[1966]
9952176404901401,.b1172643x,"Studying law; selections from the writings of Albert J. Beveridge, John Maxcy Zane, Munroe Smith [and others] Edited by Arthur T. Vanderbilt.",Washington Square Pub. Corp.,[1945]
9952176456901401,.b11718717,Land reform in principle and practice.,"Clarendon P.,",1969.
9952176457201401,.b11718687,"Road to survival, with an introd. by Bernard M. Baruch; illus. by Stuart I. Freeman.",W. Sloane Associates,[1948]
9952176504401401,.b11732325,"The house of labor; internal operations of American unions, edited by J. B. S. Hardman [and] Maurice F. Neufeld.","Prentice-Hall,",1951.
9952176506401401,.b1173209x,Soviet trade unions; their place in Soviet labour policy.,Royal Institute of International Affairs,[1950]
9952176513901401,.b11732945,The local union [by] Leonard R. Sayles [and] George Strauss.,"Harcourt, Brace & World",[1967]
9952176526001401,.b11733561,"The coal industry, by A.T. Shurick.","Little, Brown, and Company,",1924.
9952176674601401,.b11812734,The unfinished revolution : human-centered computers and what they can do for us / Michael L. Dertouzos.,"HarperCollins,",c2001.
9952176674901401,.b11812709,The cathedral and the bazaar : musings on Linux and Open Source by an accidental revolutionary / Eric S. Raymond ; with a foreword by Bob Young.,"O'Reilly,",2001.
9952177040101401,.b11826149,Computer networks : a systems approach / Larry L. Peterson & Bruce S. Davie.,"Morgan Kaufmann Publishers,",c2000.
9952177040801401,.b11826113,Programming languages : principles and practice / Kenneth C. Louden.,"PWS-Kent Pub. Co.,",c1993.
9952177467801401,.b11971988,Theory-driven evaluations / Huey-tsyh Chen.,"Sage Publications,",c1990.
9952177807101401,.b13570596,Computer / Paul Atkinson.,"Reaktion Books,",2010.
9952179029301401,.b13134668,"Reflections on the teaching of programming : methods and implementations / Jens Bennedsen, Michael E. Caspersen, Michael Kölling (eds.).","Springer,",c2008.
9952179817101401,.b13885728,Thinking in Java / Bruce Eckel.,"Prentice Hall,",c2006.
9952179857301401,.b18270803,"Using iPhones, iPads, and iPods : a practical guide for librarians / Matthew Connolly and Tony Cosgrave.","Rowman & Littlefield,",[2015]
9952180326301401,.b18941606,"Duoethnography : dialogic methods for social, health, and educational research / editors, Joe Norris, Richard D. Sawyer, Darren E. Lund.","Left Coast Press,",©2012.
9952180572401401,.b20525357,"Head First design patterns / Eric Freeman, Elisabeth Robson.","O'Reilly,",2014.
9952181434801401,.b17453082,"Mastering web application development with AngularJS : build single-page web applications using the power of AngularJS / Pawel Kozlowski, Peter Bacon Darwin.","Packt Publishing,",2013.
9952160830501401,.b10007647,Eurocommunism and the state / Santiago Carrillo ; [translation from the Spanish by Nan Green and A. M. Elliott].,L. Hill ;,c1978.
9952160841301401,.b10024773,The new class: an analysis of the communist system/ by Milovan Djilas.,"Praeger,",[1957]
9952160850501401,.b10024396,"Blueprint for world conquest, as outlined by the Communist International, with an introduction by William Henry Chamberlin.","Human events,",1946.
9952161363401401,.b10034262,"The economic theory of fiscal policy, by Alan Peacock and G. K. Shaw.",St. Martin's Press,[1971]
9952161364501401,.b10034158,Trends in government financing.,"Princeton University Press,",1961.
9952161366201401,.b10033944,Federal tax treatment of foreign income [by] Lawrence B. Krause and Kenneth W. Dam.,Brookings Institution,[1964]
9952161412701401,.b10000926,Bread for the world / by Arthur Simon.,,[1975]
9952161431001401,.b10027476,The restless Brahmin; early life of M. N. Roy. With a foreword by Jadugopal Mukherjee.,Allied Publishers,[1970]
9952161440101401,.b10022090,A constitution for the socialist commonwealth of Great Britain / by Sidney and Beatrice Webb.,"Longmans, Green and Co.,",1920.
9952161442601401,.b10021826,Marx before Marxism.,Harper & Row,[1970]
9952161462701401,.b10031248,"Revolutionary syndicalism in France, the direct action of its time [by] F. F. Ridley.","University Press,",1970.
9952161492601401,.b10032411,"The national land system, 1785-1820, by Payson Jackson Treat.","E. B. Treat,",1910.
9952161500501401,.b10034468,Treasury control; the co-ordination of financial and economic policy in Great Britain.,"Clarendon Press,",1957.
9952161535201401,.b10006928,"The crown lands, 1461 to 1536 : an aspect of Yorkist and Early Tudor Government /",Allen and Unwin :,1970.
9952161668801401,.b10062579,"Fabianism in the political life of Britain, 1919-1931.",Heritage Foundation,[1954]
9952161898701401,.b1007269x,The Analysis of public output; a conference of the Universities-National Bureau Committee for Economic Research. Edited by Julius Margolis.,"National Bureau of Economic Research; distributed by Columbia Univ. Press,",1970.
9952161920201401,.b10071131,San Francisco's wilderness next door / by John Hart ; photos. by Robert Sena ; foreword by Cecil D. Andrus.,"Presidio Press,",c1979.
9952162027601401,.b10097764,"U.S. energy policy : errors of the past, proposals for the future / edited by Walter J. Mead, and Albert E. Utton.","Ballinger Pub. Co.,",c1979.
9952162513201401,.b10159563,"Energy-efficient community planning : a guide to saving energy and producing power at the local level / James Ridgeway, with Carolyn S. Projansky.","JG Press,",[1979]
9952162661101401,.b1019275x,The monetary-financial system / Lester V. Chandler.,"Harper & Row,",c1979.
9952162667701401,.b10189853,Operating systems : concepts and design / Milan Milenkovic.,"McGraw-Hill,",c1987.
9952163031601401,.b10217216,"Mitsui; three centuries of Japanese business, by John G. Roberts. Foreword by Chitoshi Yanaga.",,[1973]
9952163484001401,.b10246113,Monies in societies / Walter C. Neale.,"Chandler & Sharp,",c1976.
9952163652701401,.b10265296,The millennium postponed; socialism from Sir Thomas More to Mao Tse-tung [by] Edward Hyams.,,"[1974, c1973]"
9952163738901401,.b10282221,Jeanne Guyon / Francoise Mallet-Joris.,"Flammarion,",c1978.
9952164611401401,.b10405379,"Bank management and portfolio behavior / Donald D. Hester, James L. Pierce.","Yale University Press,",1975.
9952166975501401,.b10704565,Human-computer interaction / Jenny Preece [with] Yvonne Rogers ... [et al.].,"Addison-Wesley Pub. Co.,",c1994.
9952167339701401,.b10709812,The second self : computers and the human spirit / by Sherry Turkle.,"Simon and Schuster,",c1984.
9952167569701401,.b10758276,Computer : a history of the information machine / Martin Campbell-Kelly and William Aspray.,"Basic Books,",c1996.
9952167819601401,.b10780130,"Supposes and Jocasta; two plays translated from the Italian, the first by Geo. Gascoigne, the second by Geo. Gascoigne and F. Kinwelmersh, edited by John W. Cunliffe.","D. C. Heath & co.,",1906.
9952168236201401,.b10820115,"On conceptual modelling : perspectives from artificial intelligence, databases, and programming languages / edited by Michael L. Brodie, John Mylopoulos, Joachim W. Schmidt.","Springer-Verlag,",c1984.
9952168834301401,.b1088080x,Le mal; roman.,Editions Bernard Grasset,[c1935]
9952170065801401,.b11264184,"Computer architecture : a quantitative approach / David A. Patterson, John L. Hennessy ; with a contribution by David Goldberg.","Morgan Kaufman Publishers,",c1990.
