9952160796201401,.b1002301x,The theory and practice of socialism.,Random House,[c1936]
9952160818201401,.b1000371x,The housewares story; a history of the American housewares industry.,National Housewares Manufacturers Association,[1973]
9952160834501401,.b10002054,"Consumption and business fluctuations; a case study of the shoe, leather, hide sequence.","National Bureau of Economic Research,",1956.
9952160863601401,.b10019819,"The House Committee on Un-American Activities, 1945-1950.","Cornell University Press,",1952.
9952160869201401,.b10019443,The agrarian movement in North Dakota / by Paul R. Fossum.,"Johns Hopkins Press,",1925.
9952160872901401,.b10019212,"Industrial democracy; a plan for its achievement, by Glenn E. Plumb and William G. Roylance.","B. W. Huebsch, inc.,",1923.
9952161363201401,.b10034298,Postwar market for State and local government securities.,"Princeton University Press,",1960.
9952161433901401,.b10008913,"Fiscal zoning and land use controls : the economic issues / edited by Edwin S. Mills, Wallace E. Oates.",,[1975]
9952161470201401,.b1003268x,The income tax is obsolete [by] Joseph S. Duarte.,Arlington House,[1974]
9952161473201401,.b1003528x,Legislative texts and treaty provisions concerning the utilization of international rivers for other purposes than navigation. Textes legislatifs et dispositions de traites concernant l'utilisation des fleuves internationaux a des fins autres que la navigation.,,1963]
9952161516901401,.b10020469,"The Utopian vision of Charles Fourier; selected texts on work, love, and passionate attraction. Translated, edited and with an introd. by Jonathan Beecher and Richard Bienvenu.",Beacon Press,[1971]
9952161525901401,.b10023756,"Isms; a review of alien isms, revolutionary communism and their active sympathizers in the United States.",,1937.
9952161552401401,.b10024955,Stalin and German communism: a study in the origins of the state party/ with a pref. by Sidney B. Fay.,"Harvard Univ. Press,",1948.
9952161554101401,.b10060704,"The war period of American finance, 1908-1925, by Alexander D. Noyes. Being the continuation of ""Forty years of American finance.""","G.P. Putnam's Sons,",1926.
9952161554301401,.b10060674,"Forty years of American finance; a short financial history of the government and people of the United States since the Civil War, 1865-1907, by Alexander Dana Noyes.","G.P. Putnam's Sons,",1909.
9952161578001401,.b10062087,"Sugar in relation to the tariff, by Philip G. Wright, with the aid of the council and staff of the Institute of Economics.","McGraw-Hill,",1924.
9952161583201401,.b10060182,"Measuring benefits of government investments; papers presented at a conference of experts held November 7-9, 1963.",Brookings Institution,[1965]
9952161841801401,.b10063183,Techniques of treasury debt management.,"Graduate School of Business, Columbia University, and Free Press of Glencoe",[1962]
9952161850001401,.b10057602,India's rural development : an assessment of alternatives / Marcus Franda.,"Indiana University Press,",c1979.
9952161881101401,.b10083595,"American energy choices before the year 2000 : [proceedings] / edited by Elihu Bergman, Hans A. Bethe, Robert Marshak.","Lexington Books,",c1978.
9952161900901401,.b10072421,"Democracy and finance in China; a study in the development of fiscal systems and ideals, by Kinn Wei Shaw.","Columbia university press,",1926.
9952162759601401,.b1020281x,The Political economy of inflation / edited by Fred Hirsch and John H. Goldthorpe.,"Harvard University Press,",1978.
9952162823401401,.b10197667,Hinduism.,"Oxford University Press,","1966, 1977 printing."
9952163443701401,.b10265569,The Fabians / Norman and Jeanne MacKenzie.,"Simon and Schuster,",c1977.
9952164018901401,.b10342801,"Religion in American history : interpretive essays / John M. Mulder, John F. Wilson, editors.","Prentice-Hall,",c1978.
9952164685901401,.b1041308x,Networking CD-ROMs : the decision maker's guide to local area network solutions / Ahmed M. Elshami.,"American Library Association,",1996.
9952164719101401,.b10407844,Proust / by Samuel Beckett.,"Grove Press,",1970.
9952164754401401,.b10464463,"On Christian doctrine/ Saint Augustine; translated, with an introduction by D.W.Robertson.","Bobbs-Merrill,",c1958.
9952164936801401,.b10425962,The Energy controversy : soft path questions & answers / by Amory B. Lovins & his critics ; edited by Hugh Nash.,"Friends of the Earth,",c1979.
9952165030301401,.b1044693x,Clement Marot and the inflections of poetic voice / Robert Griffin.,"University of California Press,",1974.
9952166293801401,.b10608461,"A guide to the national parks; their landscape and geology [by] William H. Matthews, III.  Foreword by Paul M. Tilden.","Published for the American Museum of Natural History [by] the Natural History Press,",1968.
9952166348101401,.b10593342,La condition postmoderne : rapport sur le savoir / Jean-Francois Lyotard.,"Editions de Minuit,",c1979.
9952167113801401,.b10693828,"Comparing and assessing programming languages : Ada, C, and Pascal / Alan R. Feuer and Narain Gehani, editors.","Prentice-Hall,",c1984.
9952168382901401,.b10859615,"The States of 'theory' : history, art, and critical discourse / edited and with an introduction by David Carroll.","Columbia University Press,",1990.
9952168517501401,.b10842032,"The art of Lisp programming / Robin Jones, Clive Maynard, Ian Stewart.","Springer-Verlag,",c1990.
9952168736501401,.b10866681,"Shakspere; a critical study of his mind and art, by Edward Dowden ...",Harper & Brothers,[c1918]
9952169292801401,.b1093344x,"Symmetry in chaos : a search for pattern in mathematics, art and nature / Michael Field and Martin Golubitsky.","Oxford University Press,",1992.
9952170260801401,.b11280645,Computer networks / Andrew S. Tanenbaum.,"Prentice-Hall,",c1989.
9952170444901401,.b1127802x,"The GUI style guide / Susan L. Fowler, Victor R. Stanwick.","AP Professional,",c1995.
9952170852801401,.b11317942,Taking software design seriously : practical techniques for human-computer interaction design / edited by John Karat.,"Academic Press,",c1991.
9952171012801401,.b11346905,"Report of court proceedings in the case of the anti-soviet Trotskyite centre, heard before the Military collegium of the Supreme court of the U. S. S. R., Moscow, January 23-30, 1937, in re: Y. L. Pyatakov, K. B. Radek, G. Y. Sokolnikov, L. P. Serebryakov, N. I. Muralov, Y. A. Livshitz, Y. N. Drobnis, M. S. Boguslavsky, I. A. Knyazev, S. A. Rataichak, B. O. Norkin, A. A. Shestov, M. S. Stroilov, Y. D. Turok, I. Y. Hrasche, G. E. Pushin, V. V. Arnold, accused of treason against the country, espionage acts of diversion, wrecking activities and the preparation of terrorist acts, i. e., of crimes covered by articles 58(1a), 58(8), 58(9) and 58(11) of the Criminal code of the R. S. F. S. R. Verbatim report.","People's commissariat of justice of the U. S. S. R.,",1937.
9952171622501401,.b10945374,"Software ergonomics : advances and applications / editors, H.-J. Bullinger and R. Gunzenhauser ; translator, D. Lewis.",E. Horwood ;,1988.
9952171631001401,.b10960144,Science and the UFOs / Jenny Randles and Peter Warrington.,"B. Blackwell,",1985.
9952171691201401,.b1097314x,Oil and gas in coastal lands and waters : a report / by the Council on Environmental Quality ; written by Katherine Gillman : illustrated by Allen Carroll.,The Council :,1977.
9952171711501401,.b10960983,"Cults : faith, healing, and coercion / Marc Galanter.","Oxford University Press,",1989.
9952171942701401,.b10981329,Close to the machine : technophilia and its discontents / Ellen Ullman.,"City Lights Books,",c1997.
9952172281701401,.b11036989,LISP : a gentle introduction to symbolic computation / David S. Touretzky.,"Harper & Row,",c1984.
9952172750001401,.b1107372x,The pattern on the stone : the simple ideas that make computers work / W. Daniel Hillis.,"Basic Books,",c1998.
9952172843901401,.b11088230,Computer modeling : from sports to spaceflight-- from order to chaos / J.M.A. Danby.,"Willmann-Bell,",c1997.
9952173197401401,.b1113558x,"The invisible computer : why good products can fail, the personal computer is so complex, and information appliances are the solution / Donald A. Norman.","MIT Press,",c1998.
9952173462501401,.b11413098,"The modern researcher / Jacques Barzun, Henry F. Graff.","Houghton Mifflin Co.,",c1992.
9952173487901401,.b11416269,"From Baker Street to binary : an introduction to computers and computer programming / Henry Ledgard, E. Patrick McQuaid, Andrew Singer.","McGraw-Hill,",1983.
9952173617601401,.b11419957,Programming with Ada : an introduction by means of graduated examples / Peter Wegner.,"Prentice-Hall,",c1980.
9952173717801401,.b11398760,"Collected algorithms from ACM : a collation of all ACM algorithms, including certifications, remarks, and translations from ACM transactions on mathematical software...","The Association,",1960-
9952174343601401,.b11514668,Algorithmic information theory / Gregory J. Chaitin.,"Cambridge University Press,",1987.
9952174650701401,.b11544788,"Demystifying multimedia : a guide for multimedia developers /cfrom Apple Computer, Inc.; Randy Haykin, senior editor.","Apple Computer,",c1993.
9952174788401401,.b11583216,"The house of God, by Desider Holisher, with 300 photographs by the author and others.",Crown Publishers,[1946]
9952174838601401,.b11573107,"UNIX in a nutshell : System V edition : revised and expanded for SVR4 and Solaris 2.0 / Daniel Gilly and the staff of O'Reilly and Associates, Inc.","O'Reilly & Associates,",c1992.
9952175013201401,.b11607646,"An introduction to the study of some living religions of the East, by Sydney Cave...",Duckworth,[1921]
9952175065701401,.b11433826,Java performance and scalability / Dov Bulka.,"Addison-Wesley,",c2000-
9952175513301401,.b11627864,"Gregory of Tours; selections from the minor works, translated by William C. McDermott.","University of Pennsylvania Press,",1949.
9952175522001401,.b11652780,The pilgrims of Russian-town : the community of spiritual Christian jumpers in America / by Pauline V. Young ; with an introd. by Robert E. Park.,"University of Chicago Press,",1932.
9952175614401401,.b11654004,The religions of man.,Harper,[1958]
9952175698601401,.b11645052,"Mormon settlement in Arizona; a record of peaceful conquest of the desert, by James H. McClintock.",,1921.
9952175711101401,.b11644643,Methodism in American history.,Abingdon Press,[1954]
9952175714701401,.b11644448,The Puritan mind.,H. Holt and company,[c1930]
9952175978801401,.b1169807x,"Expropriation of U.S. investments in Cuba, Mexico, and Chile / Eric N. Baklanoff.","Praeger,",1975.
9952176005001401,.b11693009,The labor banking movement in the United States.,,1929.
9952176007501401,.b11692741,Balance of payments and economic growth [by] John M. Letiche.,"A. M. Kelley,",1967.
9952176078801401,.b11697660,"Main Street and Wall Street, by William Z. Ripley ...","Little, Brown, and Company,",1927.
9952176098201401,.b1169547x,"The inflationary spiral; the experience in China, 1939-1950.",Technology Press of Massachusetts Institute of Technology,[1958]
9952176103401401,.b1169970x,Food in India : an analysis of the prospects for self-sufficiency by 1975-76 / R. P. Sinha.,"Indian Branch, Oxford University Press,",1961.
9952176119301401,.b11691724,"Banking and business, by H. Parker Willis and George W. Edwards.",Harper,[1925]
9952176122701401,.b11691554,"The early history of banking in England, by R.D. Richards.","P.S. King & son, Ltd.,",1929.
9952176127701401,.b1169063x,"Money, credit & commerce, by Alfred Marshall.","Macmillan & Co., limited,",1923.
9952176173701401,.b1172884x,History of the Royal Dutch.,"Brill,",1953-57.
9952176270901401,.b11720943,Labor economics and institutions.,Macmillan,[1961]
9952176304101401,.b11710007,Economic growth and structure; selected essays [by] Simon Kuznets.,Norton,[1965]
9952176400501401,.b11717713,"The closing of the public domain: disposal and reservation policies, 1900-50.",Stanford University Press [1951],
9952176403801401,.b11726568,Private pressure on public law; the legal career of Justice Thurgood Marshall [by] Randall W. Bland.,"Kennikat Press,",1973.
9952176454501401,.b1171895x,My land is dying [by] Harry M. Caudill.,"E. P. Dutton,",1971.
9952176455301401,.b11718870,Arid lands in transition; [papers] Edited by Harold E. Dregne.,[American Association for the Advancement of Science],1970.
9952176456101401,.b11718791,"Energy and U.S. foreign policy [by] Joseph A. Yager and Eleanor B. Steinberg, with Barry M. Blechman [and others]",Ballinger Pub. Co.,[1974]
9952176457801401,.b11718626,"Ecology, pollution, environment [by] Amos Turk, Jonathan Turk [and] Janet T. Wittes.","Saunders,",1972.
9952176463301401,.b11735727,"Planning eXtreme programming / Kent Beck, Martin Fowler ; illustrated by Jennifer Kohnke ; [foreword by Tom DeMarco].","Addison-Wesley,",c2001.
9952176484401401,.b11731734,"The history and problems of organized labor, by Frank Tracy Carlton.",D. C. Heath & company,[c1920]
9952176503001401,.b11732477,The enemy within.,Harper,[1960]
9952176527601401,.b11733500,"Hot oil; the problem of petroleum, by Samuel B. Pettengill ... with an introduction by William P. Cole, jr.","Economic Forum Co., incorporated,",1936.
9952176530601401,.b11733330,"Teachers, administrators, and collective bargaining [by] Edward B. Shils [and] C. Taylor Whittier.",T. Y. Crowell Co.,[1968]
9952176866201401,.b11863742,The essential guide to user interface design : an introduction to GUI design principles and techniques / Wilbert O. Galitz.,"Wiley Computer Pub.,",c2002.
9952177038101401,.b11826277,Programming languages : concepts and constructs / Ravi Sethi.,"Addison-Wesley,",c1996.
9952177385701401,.b11927100,The art of assembly language / by Randall Hyde.,"No Starch Press,",2003.
9952177569801401,.b13752893,"The little Schemer / Daniel P. Friedman, Matthias Felleisen ; drawings by Duane Bibby ; foreword by Gerald J. Sussman.","MIT Press,",c1996.
9952177895601401,.b11988435,"The SAGE handbook of qualitative research / edited by Norman K. Denzin, Yvonna S. Lincoln.","Sage Publications,",c2005.
9952178092301401,.b12038441,Electronic brains : stories from the dawn of the computer age / Mike Hally.,"Joseph Henry Press,",c2005.
9952179637401401,.b13902222,Networks : an introduction / M.E.J. Newman.,"Oxford University Press,",2010.
9952179932201401,.b18014549,"Cloud computing : concepts, technology, & architecture / Thomas Erl, Zaigham Mahmood and Richardo Puttini.","Prentice Hall,",[2013]
9952181068801401,.b16014765,Research beyond borders : multidisciplinary reflections / edited by Lise-Hélène Smith and Anjana Narayan.,"Lexington Books,",c2012.
9952181151201401,.b15387756,"Java puzzlers : traps, pitfalls, and corner cases / Joshua Bloch, Neal Gafter.","Addison-Wesley,",c2005.
9952181507101401,.b17722032,"The app generation : how today's youth navigate identity, intimacy, and imagination in a digital world / Howard Gardner and Katie Davis.","Yale University Press,",[2013]
9952160781001401,.b10029035,"German National Socialism, 1919-1945. Translated from the German by Kurt Rosenbaum and Inge Pauli Boehm.",Clio Press,[1966]
9952160788801401,.b10001554,"Newsprint: producers, publishers, political pressures. Including the text of Print paper pendulum; group pressures and the price of newsprint.",Rutgers University Press,[1960]
9952160789301401,.b10001499,"The growth of manufactures 1899 to 1923. A study of indexes of increase in the volume of manufactured products, by Edmund E. Day and Woodlief Thomas ...","U.S. Govt. Print. Off.,",1928.
9952160802601401,.b10021048,"The socialism of our times; a symposium by Harry Elmer Barnes, Stuart Chase, Paul H. Douglas ... and others.  Edited by Harry W. Laidler and Norman Thomas.","The Vanguard press, League for industrial democracy",[c1929]
9952160805401401,.b10020755,"Russian radicals look to America, 1825-1894.","Greenwood Press,","1968, c1947]"
9952160855601401,.b10026939,Dilemmas of progress in tsarist Russia : legal Marxism and legal Populism / Arthur P. Mendel.,"Harvard University Press,",1961.
9952160870801401,.b10025790,Change in Communist systems. Contributors: Jeremy R. Azrael [and others] Edited by Chalmers Johnson.,"Stanford University Press,",1970.
9952161352901401,.b10033762,Trusts and estate taxation [by] Gerald R. Jantscher.,Brookings Institution,[1967]
9952161365901401,.b1003397x,Tax credits and intergovernmental fiscal relations.,Brookings Institution,[1962]
9952161366501401,.b10033907,Tax-exempt securities and the surtax / by Charles O. Hardy.,"Macmillan,",1926.
9952161366801401,.b10033877,Readings on taxation in developing countries. Edited by Richard Bird and Oliver Oldman.,"Johns Hopkins Press,",1964.
9952161376201401,.b10031583,The alternative; communal life in new America. Photographed by Dennis Stock. Designed by Will Hopkins.,Macmillan,[1970]
9952161432501401,.b10027300,"I led 3 lives: citizen, ""Communist,"" counterspy.",McGraw-Hill,[1952]
9952161493301401,.b10032320,"Public finances: needs, sources, and utilization; a conference of the Universities-National Bureau Committee for Economic Research.","Princeton University Press,",1961.
9952161493701401,.b10032265,The theory of fiscal economics.,"University of California Press,",1954.
9952161511501401,.b10027956,The Rosa Luxemburg contraceptives cooperative; a primer on Communist civilization.,Macmillan,"[1971, c1972]"
9952161516201401,.b10020512,The teaching of Charles Fourier [by] Nicholas V. Riasanovsky.,"University of California Press,",1969.
9952161523401401,.b10024098,European communism.,Harper,[1953]
9952161523701401,.b10024062,Communism and revolution; the strategic uses of political violence. Edited by Cyril E. Black and Thomas P. Thornton.,"Princeton University Press,",1964.
9952161543501401,.b10025431,World communism: key documentary material.,Van Nostrand,[c1962]
9952161582201401,.b1006154x,"International commercial policies, with special reference to the United States; a text-book, by George Mygatt Fisk and Paul Skeels Peirce.","Macmillan,",1923.
9952161584201401,.b10060078,"The internal debts of the United States, edited by Evans Clark ... assisted by George B. Galloway.","Pub. for Twentieth century fund, inc., The Macmillan company,",1933.
9952161696401401,.b10045144,"Energy resources / J. T. McMullan, R. Morgan, and R. B. Murray.","Wiley,",c1977.
9952161846801401,.b10062786,"Socialism as it is; a survey of the world-wide revolutionary movement, by William English Walling.","The Macmillan company,",1912.
9952161947401401,.b10075975,The common reader : first series / Virginia Woolf.,"Hogarth Press,",1975.
9952162212101401,.b10133070,"Energy in America's future : the choices before us : a study / by the staff of the RFF National Energy Strategies Project ; by Sam H. Schurr, project director ... [et al.].","Published for Resources for the Future by Johns Hopkins University Press,",c1979.
9952162574501401,.b10185860,Programming in Common LISP / Rodney A. Brooks.,"Wiley,",c1985.
9952163081301401,.b10245418,Selected political writings of Rosa Luxemburg / edited and introd. by Dick Howard.,"Monthly Review Press,",1971.
9952163588901401,.b10297625,"A history of world communism / F. W. Deakin, H. Shukman, and H. T. Willetts.","Barnes & Noble Books,",1975.
9952164242401401,.b10363208,"The Who's Who of Nobel Prize winners, 1901-1990 / edited by Bernard S. Schlessinger and June H. Schlessinger ; Rashelle S. Karp, Louise Sherby, and Parvin Kujoory, associate editors ; foreword by Wilhelm Odelberg.","Oryx Press,",1991.
9952165667001401,.b10531932,"Grammatical man : information, entropy, language, and life / by Jeremy Campbell.","Simon and Schuster,",c1982.
9952165861801401,.b10577592,The minicomputer in the laboratory : with examples using the PDP-11 / James W. Cooper.,"Wiley,",1983.
9952166861601401,.b10678359,"Computability, complexity, and languages : fundamentals of theoretical computer science / Martin D. Davis, Elaine J. Weyuker.","Academic Press,",1983.
9952167090601401,.b10694109,"The duel and the oath / Henry Charles Lea ; with additional original documents in translation by Arthur C. Howland ; edited, with an introd. by Edward Peters.","University of Pennsylvania Press,",[1974]
9952167443701401,.b10737455,High performance computing : challenges for future systems / David J. Kuck.,"Oxford University Press,",1996.
9952167458701401,.b1077242x,"The bright island, by Arnold Bennett.",Doran,[c1925]
9952168177501401,.b1083879x,Japanese mythology.,"Hamlyn,",1969.
9952168577701401,.b10873703,"Programming language concepts / Carlo Ghezzi, Mehdi Jazayeri.","Wiley,",c1982.
9952169168501401,.b10943158,"The rise of Puritanism, or, The way to the New Jerusalem : as set forth in pulpit and press from Thomas Cartwright to John Lilburne and John Milton, 1570-1643 / William Haller.","University of Pennsylvania Press,",1984.
9952169475901401,.b11201150,"Church and Parliament; the reshaping of the Church of England, 1828-1860.","Stanford University Press,",1959.
9952169762001401,.b11217819,Structured computer organization / Andrew S. Tanenbaum.,"Prentice Hall,",c1990.
9952170458401401,.b11297505,Classics of Protestantism / edited by Vergilius Ferm.,"Philosophical Library,",1959.
9952170639201401,.b11299976,"COMMON LISP : the language / Guy L. Steele, Jr. ; with contributions by Scott E. Fahlman ... [et al.] and with contributions to the 2nd ed. by Daniel G. Bobrow ... [et al.].","Digital Press,",c1990.
9952170938501401,.b11329415,"Minds, machines, and the multiverse : the quest for the quantum computer / Julian Brown.","Simon & Schuster,",c2000.
9952171088501401,.b11369462,The Production and application of new industrial technology / Edwin Mansfield ... [et al.].,"Norton,",c1977.
9952171238601401,.b11361542,Computer models of thought and language / edited by Roger C. Schank [and] Kenneth Mark Colby.,"W. H. Freeman,",c1973.
9952171911601401,.b10981974,"Handbook of human-computer interaction / edited by Martin G. Helander, Thomas K. Landauer, Prasad V. Prabhu.","Elsevier,",1997.
9952172372301401,.b11064006,With their islands around them.,"Holt, Rinehart and Winston",[1974]
9952172908001401,.b11109105,A catalogue of the Ellis collection of ornithological books in the University of Kansas Libraries. Compiled by Robert M. Mengel.,,1972-
9952172955001401,.b11123163,The Scheme programming language / R. Kent Dybvig.,"Prentice-Hall,",c1987.
9952173474601401,.b11385698,Essays on the Iliad : selected modern criticism / edited by John Wright.,"Indiana University Press,",c1978.
9952173877001401,.b11472686,"Seven keys to Brazil, by Vera Kelsey ...",Funk & Wagnalls Company,[1941]
9952174298901401,.b1151663x,Computers and man / Richard C. Dorf.,"Boyd & Fraser Pub. Co.,",c1977.
9952174326801401,.b11515119,"Beginning programming with Ada / James A. Saxon, Robert E. Fritz.","Prentice-Hall,",c1983.
9952174796301401,.b11583435,"America, a sketch of its political, social, and religious character.","Belkap Press of Harvard University Press,",1961.
9952174976701401,.b11620547,A treasury of early Christianity.,"Viking Press,",1953.
9952174981501401,.b11620948,"As I see it, by Stephen S. Wise.","Jewish Opinion Publishing Corporation,",1944.
9952174983301401,.b11620122,Archibald the Arctic.,Appleton-Century-Crofts,[1956]
9952175141501401,.b11611133,Shakti : power in the conceptual structure of Karimpur religion / Susan Snow Wadley.,"Dept. of Anthropology, University of Chicago,",1975.
9952175435401401,.b11441860,PL/I and PL/C language manual / C. William Gear.,"Science Research Associates,",c1978.
9952175581901401,.b1165420x,"Tongues of fire; a bible of sacred scriptures of the pagan world, compiled by Grace H. Turnbull ...","The Macmillan Company,",1929.
9952175583301401,.b11652597,Quakers in science and industry; being an account of the Quaker contributions to science and industry during the 17th and 18th centuries.,Philosophical Library,[1950]
9952175698201401,.b1164509x,"The kingdom of Saint James; a narrative of the Mormons, by Milo M. Quaife ...",Yale University Press;,1930.
9952175711401401,.b1164462x,Methodism and the frontier; Indiana proving ground.,Columbia University Press,1941.
9952175972201401,.b11698871,Early American land companies : their influence on corporate development / by Shaw Livermore.,The Commonwealth Fund ;,1939.
9952175977101401,.b11698159,Determinants of investment behavior; a conference of the Universities-National Bureau Committee for Economic Research. Edited by Robert Ferber.,"National Bureau of Economic Research; distributed by Columbia University Press,",1967.
9952175979101401,.b11698500,"Scarcity and growth; the economics of natural resource availability, by Harold J. Barnett and Chandler Morse.","Published for Resources for the Future by Johns Hopkins Press, Baltimore",[1963]
9952175991901401,.b11693782,"The state theory of money, by Georg Friedrich Knapp.  Abridged ed., tr. by H. M. Lucas and J. Bonar.","Published on behalf of the Royal Economic Society by Macmillan and Co., limited,",1924.
9952176005601401,.b11692935,"The bank that banks built; the story of Savings Banks Trust Company, 1933-1958.",Harper,[1959]
9952176089401401,.b11699462,The land & the peasant in Rumania; the war and agrarian reform (1917-21),"H. Milford, Oxford University Press;",1930.
9952176103901401,.b11699681,"A study of land reforms in Uttar Pradesh, by Baljit Singh and Shridhar Misra.",East-West Center Press,[1965]
9952176131301401,.b11690409,"Domestic and foreign exchange, theory and practice, by Ira B. Cross.",The Macmillan company,[c1923] 1924.
9952176134301401,.b11690240,Boycotts and the labor struggle economic and legal aspects by Harry W. Laidler with an introduction by Henry R. Seager...,"John Lane company,",1914
